,Unnamed: 0,Series_Title,Released_Year,Certificate,Runtime,Genre,IMDB_Rating,Overview,Meta_score,Director,Star1,Star2,Star3,Star4,No_of_Votes,Gross,Keywords,date_details
267,268,Platoon,1986,R,120,"Drama, War",8.1,"Chris Taylor, a neophyte recruit in Vietnam, finds himself caught in a battle of wills between two sergeants, one good and the other evil. A shrewd examination of the brutality of war and the duality of man in conflict.",92.0,Oliver Stone,Charlie Sheen,Tom Berenger,Willem Dafoe,Keith David,381222,138530565.0,"['dying and death', 'vietnam war', 'helicopter', 'ambush', 'war crimes', 'village', 'mine', 'bunker', 'infantry', 'jungle', 'gang rape', 'soldier', 'battle', 'violent death', 'false accusations', 'platoon', 'combat', 'casualty of war', 'marijuana joint', 'marijuana pipe', 'semi autobiographical', 'anti war', 'wounded soldier', 'conscripts', 'military draft', 'violent man', 'american soldiers', 'tour of duty', 'murder witness', 'army vs civilians', 'cautionary', 'suspenseful', 'critical', 'intense', 'defiant', 'philosophical depiction of war']",2024-08-01
268,269,"Paris, Texas",1984,R,145,Drama,8.1,"Travis Henderson, an aimless drifter who has been missing for four years, wanders out of the desert and must reconnect with society, himself, his life, and his family.",78.0,Wim Wenders,Harry Dean Stanton,Nastassja Kinski,Dean Stockwell,Aurore Clément,91188,2181987.0,"['van', 'regret', 'sibling relationship', 'texas', 'peep show', 'redemption', 'mute', 'los angeles, california', 'on the road', 'desert', 'family', 'modern-day western', 'neo-western', 'new german cinema', 'fugue state']",2025-08-18
269,270,Kaze no tani no Naushika,1984,PG,117,"Animation, Adventure, Fantasy",8.1,Warrior and pacifist Princess Nausicaä desperately struggles to prevent two warring nations from destroying themselves and their dying planet.,86.0,Hayao Miyazaki,Sumi Shimamoto,Mahito Tsujimura,Hisako Kyôda,Gorô Naya,150924,495770.0,"['future', 'airplane', 'saving the world', 'human vs nature', 'fungus spores   ', 'post-apocalyptic future', 'giant insect', 'toxic', 'based on manga', 'ecology', 'anime', 'inspirational', 'adventure']",2025-06-25
270,271,The Thing,1982,R,109,"Horror, Mystery, Sci-Fi",8.1,A research team in Antarctica is hunted by a shape-shifting alien that assumes the appearance of its victims.,57.0,John Carpenter,Kurt Russell,Wilford Brimley,Keith David,Richard Masur,371271,13782838.0,"['spacecraft', 'helicopter', 'space marine', 'based on novel or book', 'isolation', 'mutation', 'paranoia', 'grave', 'snowstorm', 'research station', 'alien life-form', 'alien', 'remake', 'survival', 'creature', 'helicopter pilot', 'antarctica', 'shape shifting alien', 'alien infection', 'survival horror', 'sled dogs', 'alien monster', 'alien parasites', 'isolated place', 'uncertainty', 'blood test', 'body horror', 'ambiguity', 'critical', 'antarctic']",2019-03-28
271,272,Pink Floyd: The Wall,1982,R,95,"Drama, Fantasy, Music",8.1,A confined but troubled rock star descends into madness in the midst of his physical and social isolation from everyone.,47.0,Alan Parker,Bob Geldof,Christine Hargreaves,James Laurenson,Eleanor David,76081,22244207.0,"['rock star', 'berlin wall', 'paranoia', 'wall', 'descent into madness', 'rock musical', 'adult animation']",2006-06-05
272,273,Fitzcarraldo,1982,PG,158,"Adventure, Drama",8.1,"The story of Brian Sweeney Fitzgerald, an extremely determined man who intends to build an opera house in the middle of a jungle.",,Werner Herzog,Klaus Kinski,Claudia Cardinale,José Lewgoy,Miguel Ángel Fuentes,31595,,"['peru', 'plantation', 'ambition', 'amazon rainforest', 'steamboat', 'south america', 'opera house', 'riverboat', '19th century', 'imperialism', 'iquitos, peru', 'amazon river', 'rubber', 'white water rafting', 'willpower', 'manaos, brazil', 'transporting boat', 'amazonie']",2015-01-19
273,274,Fanny och Alexander,1982,R,188,Drama,8.1,"Two young Swedish children experience the many comedies and tragedies of their family, the Ekdahls.",100.0,Ingmar Bergman,Bertil Guve,Pernilla Allwin,Kristina Adolphson,Börje Ahlstedt,57784,4971340.0,"['dying and death', 'child abuse', 'sibling relationship', 'funeral', 'loss of loved one', 'sweden', 'bishop', 'theatre group', 'child prodigy', 'dysfunctional family', 'ghost', 'hamlet', 'turn of the century', 'christmas', '1900s', '20th century', 'family chronicle']",2022-12-02
274,275,Blade Runner,1982,R,117,"Action, Sci-Fi, Thriller",8.1,"A blade runner must pursue and terminate four replicants who stole a ship in space, and have returned to Earth to find their creator.",84.0,Ridley Scott,Harrison Ford,Rutger Hauer,Sean Young,Edward James Olmos,693827,32868943.0,"['android', 'flying car', 'bounty hunter', 'artificial intelligence (a.i.)', 'genetics', 'based on novel or book', 'dystopia', 'futuristic', 'fugitive', 'cyberpunk', 'los angeles, california', 'alcoholic', 'origami', 'unicorn', 'tech noir', 'meditative', 'neo-noir', 'human clone', 'blade runner', '2010s', 'introspective']",2023-04-26
275,276,The Elephant Man,1980,PG,124,"Biography, Drama",8.1,"A Victorian surgeon rescues a heavily disfigured man who is mistreated while scraping a living as a side-show freak. Behind his monstrous façade, there is revealed a person of kindness, intelligence and sophistication.",78.0,David Lynch,Anthony Hopkins,John Hurt,Anne Bancroft,John Gielgud,220078,,"['exploitation', 'biography', 'based on true story', 'hospital', 'black and white', 'curiosity', 'sideshow', 'disfigurement', 'deformed', 'physical deformity', 'freak', '19th century', 'dignity']",2025-02-21
276,277,Life of Brian,1979,R,94,Comedy,8.1,"Born on the original Christmas in the stable next door to Jesus Christ, Brian of Nazareth spends his life being mistaken for a messiah.",77.0,Terry Jones,Graham Chapman,John Cleese,Michael Palin,Terry Gilliam,367250,20045115.0,"['roman empire', 'jewry', 'three kings', 'crucifixion', 'bethlehem', 'independence movement', 'satire', 'parody', 'religion', 'sermon on the mount', 'anarchic comedy', 'mother son relationship', 'hilarious', 'religious satire']",2024-03-21
277,278,The Deer Hunter,1978,R,183,"Drama, War",8.1,An in-depth examination of the ways in which the U.S. Vietnam War impacts and disrupts the lives of people in a small industrial town in Pennsylvania.,86.0,Michael Cimino,Robert De Niro,Christopher Walken,John Cazale,John Savage,311361,48979328.0,"['vietnam war', 'vietnam veteran', 'small town', 'suicide', 'vietnam', 'post-traumatic stress disorder (ptsd)', 'escape', 'pennsylvania, usa', 'saigon', 'friends', 'russian roulette', 'wedding', 'deer hunting', 'steel worker', 'anti war', 'revolver', 'drunkenness', 'viet cong', 'romantic triangle', 'friends love same woman', 'prisoner of war camp', 'slavic american']",2022-09-08
278,279,Rocky,1976,PG,120,"Drama, Sport",8.1,A small-time boxer gets a supremely rare chance to fight a heavy-weight champion in a bout in which he strives to go the distance for his self-respect.,70.0,John G. Avildsen,Sylvester Stallone,Talia Shire,Burt Young,Carl Weathers,518546,117235247.0,"['underdog', 'philadelphia, pennsylvania', 'transporter', ""love of one's life"", 'italian american', 'sports', 'fight', 'independence', 'publicity', 'boxer', 'training', 'lovers', 'world champion', 'victory', 'surprise', 'boxing', 'absurd', 'hopeful']",2025-01-01
279,280,Network,1976,R,121,Drama,8.1,A television network cynically exploits a deranged former anchor's ravings and revelations about the news media for its own profit.,83.0,Sidney Lumet,Faye Dunaway,William Holden,Peter Finch,Robert Duvall,144911,,"['adultery', 'new york city', 'corruption', 'profit', 'satire', 'tv ratings', 'murder', 'corporate', 'reporter', 'co-workers relationship', 'rage', 'anger', 'tv show in film', 'meeting', 'political satire', 'news', 'fired', 'network', 'anchor', 'tv news anchor']",2015-03-23
280,281,Barry Lyndon,1975,PG,185,"Adventure, Drama, History",8.1,An Irish rogue wins the heart of a rich widow and assumes her dead husband's aristocratic position in 18th-century England.,89.0,Stanley Kubrick,Ryan O'Neal,Marisa Berenson,Patrick Magee,Hardy Krüger,149843,,"['based on novel or book', 'gambling', 'desertion', 'fencing', 'palace', 'british army', 'opportunist', 'wealth', 'debt', 'duel', 'ireland', 'british soldier', '18th century', 'card playing', 'pistol duel', 'seven years war', 'nobility', 'prussia', 'cautionary']",2025-05-23
281,282,Zerkalo,1975,NR,107,"Biography, Drama",8.1,"A dying man in his forties remembers his past. His childhood, his mother, the war, personal moments and things that tell of the recent history of all the Russian nation.",,Andrei Tarkovsky,Margarita Terekhova,Filipp Yankovskiy,Ignat Daniltsev,Oleg Yankovskiy,40081,177345.0,"['dreams', 'wind', 'poetry', 'world war ii', 'cigarette', 'field', 'spanish civil war (1936-39)', 'nostalgia', 'forest', 'terminal illness', 'flashback', 'dying man', 'avant-garde', 'illness', 'childhood', 'post world war ii', 'dream sequence', 'newsreel footage', 'nostalgic', 'reflection', 'poetry recitation', 'russian history', 'sepia color', 'historical drama', 'memoirs', '1940s', '1960s', 'non-narrative', 'somber', 'self reflection', '1930s', 'reflective', 'portrait of an artist', 'dreamlike', 'russia', 'soviet union history', 'memories', 'stream of consciousness', 'existentialist', '20th century', 'experimental film', 'pre war soviet union', 'russian poetry', 'nonlinear narrative', 'voice-over', 'nostalgic memory', 'biographical drama', 'the great patriotic war', 'dying poet']",2021-11-16
282,283,Chinatown,1974,R,130,"Drama, Mystery, Thriller",8.1,"A private detective hired to expose an adulterer finds himself caught up in a web of deceit, corruption, and murder.",92.0,Roman Polanski,Jack Nicholson,Faye Dunaway,John Huston,Perry Lopez,294230,29000000.0,"['dying and death', 'sea', 'pedophilia', 'rape', 'mistake in person', 'river', 'chinatown', 'barrage', 'femme fatale', 'conspiracy', 'whodunit', 'los angeles, california', 'private detective', 'neo-noir']",2024-03-14
283,284,Paper Moon,1973,PG,102,"Comedy, Crime, Drama",8.1,"During the Great Depression, a con man finds himself saddled with a young girl who may or may not be his daughter, and the two forge an unlikely partnership.",77.0,Peter Bogdanovich,Ryan O'Neal,Tatum O'Neal,Madeline Kahn,John Hillerman,42285,30933743.0,"['friendship', 'funeral', 'missouri', 'bible', 'con man', 'carnival', 'great depression', 'aunt', 'road trip', 'kansas, usa', 'black and white', 'con', 'tween girl']",2015-05-25
284,285,Viskningar och rop,1972,R,91,Drama,8.1,"When a woman dying of cancer in early twentieth-century Sweden is visited by her two sisters, long-repressed feelings between the siblings rise to the surface.",,Ingmar Bergman,Harriet Andersson,Liv Ullmann,Kari Sylwan,Ingrid Thulin,30206,1742348.0,"['dying and death', 'sibling relationship', 'sweden', 'sister', 'cancer', 'mansion', '19th century']",2018-11-20
285,286,Solaris,1972,PG,167,"Drama, Mystery, Sci-Fi",8.1,A psychologist is sent to a station orbiting a distant planet in order to discover what has caused the crew to go insane.,90.0,Andrei Tarkovsky,Natalya Bondarchuk,Donatas Banionis,Jüri Järvet,Vladislav Dvorzhetskiy,81021,,"['loss of sense of reality', 'based on novel or book', 'extraterrestrial technology', '1970s', 'subconsciousness', 'soviet union', 'hallucination', 'space travel', 'astronaut']",2024-05-13
286,287,Le samouraï,1967,PG,105,"Crime, Drama, Mystery",8.1,After professional hitman Jef Costello is seen by witnesses his efforts to provide himself an alibi drive him further into a corner.,,Jean-Pierre Melville,Alain Delon,François Périer,Nathalie Delon,Cathy Rosier,45434,39481.0,"['paris, france', 'police', 'hitman', 'jazz club', 'treason', 'stakeout', 'french noir', 'contract killer', 'mysterious', 'professional assassin', 'neo-noir', 'complex relationship', 'ominous']",2025-05-29
287,288,Cool Hand Luke,1967,PG,127,"Crime, Drama",8.1,"A laid back Southern man is sentenced to two years in a rural prison, but refuses to conform.",92.0,Stuart Rosenberg,Paul Newman,George Kennedy,Strother Martin,J.D. Cannon,161984,16217773.0,"['prison', 'dying and death', 'florida', 'based on novel or book', 'escape', 'loss of loved one', 'rebel', 'harassment', 'imprisonment', 'barbed wire', 'death', 'prison farm']",2025-07-03
288,289,Persona,1966,15,85,"Drama, Thriller",8.1,A nurse is put in charge of a mute actress and finds that their personae are melding together.,86.0,Ingmar Bergman,Bibi Andersson,Liv Ullmann,Margaretha Krook,Gunnar Björnstrand,103191,,"['dreams', 'nurse', 'confession', 'identity crisis', 'mental breakdown', 'betrayal', 'mute', 'black and white', 'patient', 'psychiatry', 'submerged', 'mysterious', 'institution', 'dual personality', 'stage actress', 'duality', 'dissociative identities', 'empathetic']",2018-11-20
289,290,Andrei Rublev,1966,R,205,"Biography, Drama, History",8.1,"The life, times and afflictions of the fifteenth-century Russian iconographer St. Andrei Rublev.",,Andrei Tarkovsky,Anatoliy Solonitsyn,Ivan Lapikov,Nikolay Grinko,Nikolay Sergeev,46947,102021.0,"['rape', 'christianity', 'monk', 'artist', 'cathedral', 'crucifixion', 'famine', 'painter', 'icon', 'biography', 'tatars', 'teacher', 'bell', 'black and white', 'torture', 'massacre', 'brutality', 'middle ages (476-1453)', 'monastery', 'tartar', 'bell maker', 'philosophical', '15th century', 'religious vow']",2019-09-19
290,291,La battaglia di Algeri,1966,NR,121,"Drama, War",8.1,"In the 1950s, fear and violence escalate as the people of Algiers fight for independence from the French government.",96.0,Gillo Pontecorvo,Brahim Hadjadj,Jean Martin,Yacef Saadi,Samia Kerbash,53089,55908.0,"['revolution', 'algerian', 'insurrection', 'black and white', 'algiers, algeria', 'resistance fighter', 'north africa', 'algerian war (1954-62)', 'battle of algiers', 'struggle for independence', 'anti-colonialism', 'maghreb', 'djazair', 'independance war']",2021-10-27
291,292,El ángel exterminador,1962,U,95,"Drama, Fantasy",8.1,The guests at an upper-class dinner party find themselves unable to leave.,,Luis Buñuel,Silvia Pinal,Jacqueline Andere,Enrique Rambal,José Baviera,29682,,"['sheep', 'quarantine', 'upper class', 'guest', 'room', 'surrealism', 'lamb', 'bear', 'mansion', 'black and white', 'roman catholic church', 'pretension', 'dinner party', 'piano', 'provocative']",2025-07-24
292,293,What Ever Happened to Baby Jane?,1962,NR,134,"Drama, Horror, Thriller",8.1,A former child star torments her paraplegic sister in their decaying Hollywood mansion.,75.0,Robert Aldrich,Bette Davis,Joan Crawford,Victor Buono,Wesley Addy,50058,4050000.0,"['beach', 'sibling relationship', 'based on novel or book', 'insanity', 'wheelchair', 'sister', 'aging', 'alcoholism', 'murder', 'hollywood', 'mental illness', 'invalid', 'former child star', 'ice cream', 'vaudeville', 'recluse', 'drunkenness', 'spinsters', 'old mansion', 'piano', 'sister sister relationship', 'hagsploitation', 'psycho-biddy']",2004-10-08
293,294,Sanjuro,1962,NR,96,"Action, Comedy, Crime",8.1,"A crafty samurai helps a young man and his fellow clansmen save his uncle, who has been framed and imprisoned by a corrupt superintendent.",,Akira Kurosawa,Toshirô Mifune,Tatsuya Nakadai,Keiju Kobayashi,Yûnosuke Itô,33044,,"['japan', 'samurai', 'corruption', 'temple', 'fighter', 'black and white', 'jidaigeki', 'edo period', 'feudal japan', 'bakumatsu']",2025-03-17
294,295,The Man Who Shot Liberty Valance,1962,PG-13,123,"Drama, Western",8.1,A senator returns to a western town for the funeral of an old friend and tells the story of his origins.,94.0,John Ford,James Stewart,John Wayne,Vera Miles,Lee Marvin,68827,,"['gunslinger', 'showdown', 'funeral', 'legend', 'ranch', 'outlaw', 'lawyer', 'black and white', 'stagecoach', 'cowboy']",2022-05-24
295,296,Ivanovo detstvo,1962,PG,95,"Drama, War",8.1,"In WW2, twelve year old Soviet orphan Ivan Bondarev works for the Soviet army as a scout behind the German lines and strikes a friendship with three sympathetic Soviet officers.",,Andrei Tarkovsky,Eduard Abalov,Nikolay Burlyaev,Valentin Zubkov,Evgeniy Zharikov,31728,,"['dreams', 'spy', 'world war ii', 'swamp', 'flashback', 'black and white', 'animals', 'apple', 'flare', '1940s', 'children in wartime']",2022-01-04
296,297,Jungfrukällan,1960,15,89,Drama,8.1,"An innocent yet pampered young virgin and her family's pregnant and jealous servant set out to deliver candles to church, but only one returns from events that transpire in the woods along the way.",,Ingmar Bergman,Max von Sydow,Birgitta Valberg,Gunnel Lindblom,Birgitta Pettersson,26697,1526000.0,"['rape', 'brother', 'peasant', 'child murder', 'revenge', 'pregnant woman', 'medieval', 'rape and revenge', '13th century', 'spring (water)']",2022-12-08
297,298,Inherit the Wind,1960,NR,128,"Biography, Drama, History",8.1,"Based on a real-life case in 1925, two great lawyers argue the case for and against a science teacher accused of the crime of teaching evolution.",75.0,Stanley Kramer,Spencer Tracy,Fredric March,Gene Kelly,Dick York,27254,,"['politician', 'based on true story', 'trial', 'teacher', 'lawyer', 'courtroom', 'evolution', 'rhetoric', 'scopes monkey trial', 'judiciary', 'courtroom drama']",2005-02-16
298,299,Les quatre cents coups,1959,NR,99,"Crime, Drama",8.1,"A young boy, left without attention, delves into a life of petty crime.",,François Truffaut,Jean-Pierre Léaud,Albert Rémy,Claire Maurier,Guy Decomble,105291,,"['paris, france', 'delinquent', 'coming of age', 'black and white', 'fingerprint', 'semi autobiographical', 'skipping school', 'mugshot', 'strict teacher', 'montmartre, paris']",2016-04-13
299,300,Ben-Hur,1959,G,212,"Adventure, Drama, History",8.1,"After a Jewish prince is betrayed and sent into slavery by a Roman friend, he regains his freedom and comes back for revenge.",90.0,William Wyler,Charlton Heston,Jack Hawkins,Stephen Boyd,Haya Harareet,219466,74700000.0,"['epic', 'governor', 'middle east', 'based on novel or book', 'roman empire', 'politics', 'christianity', 'jew persecution', 'jewish life', 'roman', 'miracle', 'jerusalem', 'prince', 'chariot race', 'leprosy', 'redemption', 'religious conversion', 'ancient rome', 'love', 'friends', 'remake', 'revenge', 'judaism', 'religion', 'historical fiction', 'period drama', 'dungeon', 'galley', 'hatred', 'sheikh', 'sea battle', 'jewish family', 'galley slave', 'childhood sweetheart', 'salvation', '1st century', 'jesus christ', 'false imprisonment', 'judea', 'subjugated people', 'awestruck']",2017-06-19
300,301,Kakushi-toride no san-akunin,1958,PG,139,"Adventure, Drama",8.1,"Lured by gold, two greedy peasants unknowingly escort a princess and her general across enemy lines.",,Akira Kurosawa,Toshirô Mifune,Misa Uehara,Minoru Chiaki,Kamatari Fujiwara,34797,,"['japan', 'male friendship', 'jidaigeki', 'sengoku period', 'feudal japan', '16th century', 'mountain fortress']",2024-10-26
301,302,Le notti di Cabiria,1957,16,110,Drama,8.1,A waifish prostitute wanders the streets of Rome looking for true love but finds only heartbreak.,,Federico Fellini,Giulietta Masina,François Périer,Franca Marzi,Dorian Gray,42940,752045.0,"['rome, italy', 'optimism', 'house', 'poverty', 'prostitution', 'madonna', 'heartbreak', 'rescue from drowning', 'ostia italy', 'shrine', 'hypnotist', 'railway station', 'starving', 'accountant']",2025-09-18
302,303,Kumonosu-jô,1957,12,110,"Drama, History",8.1,"A war-hardened general, egged on by his ambitious wife, works to fulfill a prophecy that he would become lord of Spider's Web Castle.",,Akira Kurosawa,Toshirô Mifune,Minoru Chiaki,Isuzu Yamada,Takashi Shimura,46678,,"['japan', 'samurai', 'based on novel or book', 'prophecy', 'castle', 'ambition', 'betrayal', 'ghost', 'jidaigeki', 'sengoku period', 'feudal lord', 'feudal japan']",2024-10-26
303,304,The Bridge on the River Kwai,1957,PG,161,"Adventure, Drama, War",8.1,"British POWs are forced to build a railway bridge across the river Kwai for their Japanese captors, not knowing that the allied forces are planning to destroy it.",87.0,David Lean,William Holden,Alec Guinness,Jack Hawkins,Sessue Hayakawa,203463,44908000.0,"['japan', 'based on novel or book', 'resistance', 'river', 'world war ii', 'prisoner of war', 'thailand', 'bridge', 'burma', 'pacific war', 'bridge blowup', 'dramatic']",2024-06-14
304,305,On the Waterfront,1954,NR,108,"Crime, Drama, Thriller",8.1,An ex-prize fighter turned longshoreman struggles to stand up to his corrupt union bosses.,91.0,Elia Kazan,Marlon Brando,Karl Malden,Lee J. Cobb,Rod Steiger,142107,9600000.0,"['corruption', 'new jersey', 'murder', 'mafia', 'black and white', 'union', 'dock', 'longshoreman', 'pigeon', 'ex-boxer']",2023-05-03
305,306,Le salaire de la peur,1953,PG-13,131,"Adventure, Drama, Thriller",8.1,"In a decrepit South American village, four men are hired to transport an urgent nitroglycerine shipment without the equipment that would make it safe.",85.0,Henri-Georges Clouzot,Yves Montand,Charles Vanel,Peter van Eyck,Folco Lulli,54588,,"['petrol', 'fire', 'life and death', 'based on novel or book', 'unsociability', 'central and south america', 'capitalism', 'venezuela', 'tanker', 'dynamite', 'male friendship', 'nitroglycerin', 'truck', 'oil', 'fear', 'explosion', 'central america', 'on the road', 'south america', 'labor', 'driver', 'road movie', 'wage', 'dangerous driving', 'fear of death', 'life or death', 'road', 'job', 'labour', 'desperation']",2024-02-19
306,307,Ace in the Hole,1951,NR,111,"Drama, Film-Noir",8.1,"A frustrated former big-city journalist now stuck working for an Albuquerque newspaper exploits a story about a man trapped in a cave to rekindle his career, but the situation quickly escalates into an out-of-control circus.",72.0,Billy Wilder,Kirk Douglas,Jan Sterling,Robert Arthur,Porter Hall,31568,3969893.0,"['rescue', 'sheriff', 'journalism', 'new mexico', 'satire', 'film noir', 'reporter', 'black and white', 'trapped', 'desert', 'newspaper man']",2018-07-05
307,308,White Heat,1949,NR,114,"Action, Crime, Drama",8.1,A psychopathic criminal with a mother complex makes a daring break from prison and leads his old gang in a chemical plant payroll heist.,,Raoul Walsh,James Cagney,Virginia Mayo,Edmond O'Brien,Margaret Wycherly,29807,,"['prison', 'undercover agent', 'parent child relationship', 'gangster', 'psychopath', ""mama's boy"", 'heist', 'film noir', 'on the run', 'shootout', 'train', 'explosion', 'killer', 'inmate', 'criminal gang', 'prison break', 'infiltrate', 'unfaithful wife']",2005-03-16
308,309,The Third Man,1949,NR,104,"Film-Noir, Mystery, Thriller",8.1,"Pulp novelist Holly Martins travels to shadowy, postwar Vienna, only to find himself investigating the mysterious death of an old friend, Harry Lime.",97.0,Carol Reed,Orson Welles,Joseph Cotten,Alida Valli,Trevor Howard,158731,449191.0,"['staged death', 'black market', 'cemetery', 'investigation', 'soviet military', 'prater', 'british army', 'austria', 'cover-up', 'film noir', 'black and white', 'foot chase', 'vienna, austria', 'sewer', 'missing person', 'post world war ii', 'ferris wheel', 'grim', 'penicillin', 'forged passport', 'ominous']",2024-11-22
309,310,The Red Shoes,1948,NR,135,"Drama, Music, Romance",8.1,A young ballet dancer is torn between the man she loves and her pursuit to become a prima ballerina.,,Michael Powell,Emeric Pressburger,Anton Walbrook,Marius Goring,Moira Shearer,30935,10900000.0,"['dance', 'new love', 'london, england', 'dance performance', 'composer', 'ballet dancer', 'ballet', 'red shoes']",2010-12-09
310,311,The Shop Around the Corner,1940,NR,99,"Comedy, Drama, Romance",8.1,"Two employees at a gift shop can barely stand each other, without realizing that they are falling in love through the post as each other's anonymous pen pal.",96.0,Ernst Lubitsch,Margaret Sullavan,James Stewart,Frank Morgan,Joseph Schildkraut,28450,203300.0,"['salesclerk', 'secret love', 'lovesickness', 'budapest, hungary', 'anonymous letter', 'man woman relationship', 'pen pals', 'love', 'co-workers relationship', 'music box', 'bickering', 'gift shop', 'holiday season', 'christmas', 'parfumerie']",2010-08-14
311,312,Rebecca,1940,NR,130,"Drama, Mystery, Romance",8.1,A self-conscious woman juggles adjusting to her new role as an aristocrat's wife and avoiding being intimidated by his first wife's spectral presence.,86.0,Alfred Hitchcock,Laurence Olivier,Joan Fontaine,George Sanders,Judith Anderson,123942,4360000.0,"['based on novel or book', 'age difference', 'obsession', 'monte carlo', 'bride', 'cornwall, england', 'love', 'film noir', 'rural area', 'devotion', 'housekeeper', 'gothic', 'death', 'estate', 'costume party', 'mysterious death', 'gothic thriller', 'age-gap relationship']",2025-01-01
312,313,Mr. Smith Goes to Washington,1939,NR,129,"Comedy, Drama",8.1,"A naive man is appointed to fill a vacancy in the United States Senate. His plans promptly collide with political corruption, but he doesn't back down.",73.0,Frank Capra,James Stewart,Jean Arthur,Claude Rains,Edward Arnold,107017,9600000.0,"['governor', 'washington dc, usa', 'senate', 'senator', 'sightseeing', 'politician', 'idealist', 'dam', 'camp', 'conservative', 'black and white', 'disillusionment', 'political corruption', 'integrity', 'usa politics', 'determination', 'filibuster', 'walkout', 'political machine', 'smear campaign', 'expulsion attempt', 'inspirational']",2024-06-14
