,Unnamed: 0,Series_Title,Released_Year,Certificate,Runtime,Genre,IMDB_Rating,Overview,Meta_score,Director,Star1,Star2,Star3,Star4,No_of_Votes,Gross,Keywords,date_details
725,726,En man som heter Ove,2015,PG-13,116,"Comedy, Drama, Romance",7.7,"Ove, an ill-tempered, isolated retiree who spends his days enforcing block association rules and visiting his wife's grave, has finally given up on life just as an unlikely friendship develops with his boisterous new neighbors.",70.0,Hannes Holm,Rolf Lassgård,Bahar Pars,Filip Berg,Ida Engvoll,47444,3358518.0,"['dark comedy', 'black humor', 'suicidal', 'pregnant woman', 'bitterness', 'volvo']",2024-01-17
726,727,What We Do in the Shadows,2014,R,86,"Comedy, Horror",7.7,"Viago, Deacon and Vladislav are vampires who are finding that modern life has them struggling with the mundane - like paying rent, keeping up with the chore wheel, trying to get into nightclubs and overcoming flatmate conflicts.",76.0,Jemaine Clement,Taika Waititi,Jemaine Clement,Taika Waititi,Cori Gonzalez-Macuer,157498,3333000.0,"['friendship', 'vampire', 'commune', 'new zealand', 'mockumentary', 'zombie', 'werewolf', 'suburb', 'heartbreak', 'fraternity', 'found footage', 'aftercreditsstinger', 'nosferatu', 'candid', 'satirical', 'communal living', 'wellington new zealand', 'amused', 'audacious', 'witches']",2020-09-15
727,728,Omoide no Mânî,2014,PG,103,"Animation, Drama, Family",7.7,"Due to 12 y.o. Anna's asthma, she's sent to stay with relatives of her guardian in the Japanese countryside. She likes to be alone, sketching. She befriends Marnie. Who is the mysterious, blonde Marnie.",72.0,James Simone,Hiromasa Yonebayashi,Sara Takatsuki,Kasumi Arimura,Nanako Matsushima,32798,765127.0,"['friendship', 'based on novel or book', 'imaginary friend', 'flashback', 'photograph', 'calm', 'anime', 'personal diary', 'psychological']",2024-04-04
728,729,The Theory of Everything,2014,PG-13,123,"Biography, Drama, Romance",7.7,A look at the relationship between the famous physicist Stephen Hawking and his wife.,72.0,James Marsh,Eddie Redmayne,Felicity Jones,Tom Prior,Sophie Perry,404182,35893537.0,"['husband wife relationship', 'biography', 'based on true story', 'physicist', 'based on memoir or autobiography', 'fictional biography', 'motor neuron disease', 'als', 'cambridge university', 'inspirational', 'admiring']",2022-06-01
729,730,Kingsman: The Secret Service,2014,R,129,"Action, Adventure, Comedy",7.7,"A spy organisation recruits a promising street kid into the agency's training program, while a global threat emerges from a twisted tech genius.",60.0,Matthew Vaughn,Colin Firth,Taron Egerton,Samuel L. Jackson,Michael Caine,590440,128261724.0,"['great britain', 'spy', 'secret organization', 'secret agent', 'based on comic', 'united kingdom', 'duringcreditsstinger', 'amused', 'excited']",2021-02-23
730,731,The Fault in Our Stars,2014,PG-13,126,"Drama, Romance",7.7,Two teenage cancer patients begin a life-affirming journey to visit a reclusive author in Amsterdam.,69.0,Josh Boone,Shailene Woodley,Ansel Elgort,Nat Wolff,Laura Dern,344312,124872350.0,"['based on novel or book', 'support group', 'amsterdam, netherlands', 'cancer', ""valentine's day"", 'star crossed lovers', 'teen drama', 'oxygen tank', 'based on young adult novel']",2022-04-04
731,732,Me and Earl and the Dying Girl,2015,PG-13,105,"Comedy, Drama",7.7,"High schooler Greg, who spends most of his time making parodies of classic movies with his co-worker Earl, finds his outlook forever altered after befriending a classmate who has just been diagnosed with cancer.",74.0,Alfonso Gomez-Rejon,Thomas Mann,RJ Cyler,Olivia Cooke,Nick Offerman,123210,6743776.0,"['high school', 'tattoo', 'based on novel or book', 'affectation', 'parody', 'leukemia', 'coming of age', 'friends', 'cancer', 'teenage boy', 'high school student', 'pittsburgh, pennsylvania', 'candid', 'based on young adult novel', 'teenager', 'absurd', 'critical', 'admiring', 'adoring', 'amused', 'complicated', 'empathetic', 'familiar', 'melodramatic']",2021-10-22
732,733,Birdman or (The Unexpected Virtue of Ignorance),2014,R,119,"Comedy, Drama",7.7,"A washed-up superhero actor attempts to revive his fading career by writing, directing, and starring in a Broadway production.",87.0,Alejandro G. Iñárritu,Michael Keaton,Zach Galifianakis,Edward Norton,Andrea Riseborough,580291,42340598.0,"['new york city', 'midlife crisis', 'superhero', 'dark comedy', 'times square', 'marijuana', 'broadway', 'magic realism', 'meditative', 'city life', 'father daughter relationship']",2021-03-24
733,734,La vie d'Adèle,2013,NC-17,180,"Drama, Romance",7.7,"Adèle's life is changed when she meets Emma, a young woman with blue hair, who will allow her to discover desire and to assert herself as a woman and as an adult. In front of others, Adèle grows, seeks herself, loses herself, and ultimately finds herself through love and loss.",89.0,Abdellatif Kechiche,Léa Seydoux,Adèle Exarchopoulos,Salim Kechiouche,Aurélien Recoing,138741,2199675.0,"['homophobia', 'self-discovery', 'eroticism', 'coming of age', 'love', 'lesbian relationship', 'sexual attraction', 'based on graphic novel', 'high school student', 'sexual desire', 'teenage sexuality', 'lgbt', 'sexual awakening', 'literary adaptation', 'social class', 'lille, france', 'self exploration', 'lesbian', 'age-gap relationship', 'teenager']",2024-07-10
734,735,Kai po che!,2013,NR,130,"Drama, Sport",7.7,Three friends growing up in India at the turn of the millennium set out to open a training academy to produce the country's next cricket stars.,40.0,Abhishek Kapoor,Amit Sadh,Sushant Singh Rajput,Rajkummar Rao,Amrita Puri,32628,1122527.0,"['cricket', 'friends', 'buddy']",2013-03-08
735,736,The Broken Circle Breakdown,2012,U,111,"Drama, Music, Romance",7.7,"Elise and Didier fall in love at first sight, in spite of their differences. He talks, she listens. He's a romantic atheist, she's a religious realist. When their daughter becomes seriously ill, their love is put on trial.",70.0,Felix van Groeningen,Veerle Baetens,Johan Heldenbergh,Nell Cattrysse,Geert Van Rampelberg,39379,175058.0,"['9/11', 'death of a child', 'intense', 'powerful']",2024-11-01
736,737,Captain America: The Winter Soldier,2014,PG-13,136,"Action, Adventure, Sci-Fi",7.7,"As Steve Rogers struggles to embrace his role in the modern world, he teams up with a fellow Avenger and S.H.I.E.L.D agent, Black Widow, to battle a new threat from history: an assassin known as the Winter Soldier.",70.0,Anthony Russo,Joe Russo,Chris Evans,Samuel L. Jackson,Scarlett Johansson,736182,259766572.0,"['washington dc, usa', 'superhero', 'shield', 'based on comic', 'aftercreditsstinger', 'duringcreditsstinger', 'marvel cinematic universe (mcu)', 'political thriller']",2016-08-29
737,738,Rockstar,2011,R15+,159,"Drama, Music, Musical",7.7,"Janardhan Jakhar chases his dreams of becoming a big Rock star, during which he falls in love with Heer.",,Imtiaz Ali,Ranbir Kapoor,Nargis Fakhri,Shammi Kapoor,Kumud Mishra,39501,985912.0,"['adultery', 'musical', 'terminal illness', 'rebellious youth', 'heartbreak', 'rock musical', 'rockstar']",2012-10-06
738,739,Nebraska,2013,R,115,"Adventure, Comedy, Drama",7.7,"An aging, booze-addled father makes the trip from Montana to Nebraska with his estranged son in order to claim a million-dollar Mega Sweepstakes Marketing prize.",87.0,Alexander Payne,Bruce Dern,Will Forte,June Squibb,Bob Odenkirk,112298,17654912.0,"['small town', 'montana', 'dementia', 'aging', 'dysfunctional family', 'road trip', 'f word', 'pickup truck', 'estranged father', 'lincoln nebraska', 'nebraska', 'sweepstakes', 'estranged son', 'confronting the past']",2016-07-09
739,740,Wreck-It Ralph,2012,PG,101,"Animation, Adventure, Comedy",7.7,"A video game villain wants to be a hero and sets out to fulfill his dream, but his quest brings havoc to the whole arcade where he lives.",72.0,Rich Moore,John C. Reilly,Jack McBrayer,Jane Lynch,Sarah Silverman,380195,189422889.0,"['video game', 'support group', 'villain', 'bullying', 'medal', 'product placement', 'jail', 'racing', 'arcade', 'self esteem', 'curiosity', 'precocious child', 'aftercreditsstinger', 'duringcreditsstinger', 'first person shooter', 'glitch', 'carefree', 'interrupted wedding', 'social reject', 'escape from jail', 'hoverboard', 'inspirational', 'admiring', 'joyful']",2013-06-05
740,741,Le Petit Prince,2015,PG,108,"Animation, Adventure, Drama",7.7,"A little girl lives in a very grown-up world with her mother, who tries to prepare her for it. Her neighbor, the Aviator, introduces the girl to an extraordinary world where anything is possible, the world of the Little Prince.",70.0,Mark Osborne,Jeff Bridges,Mackenzie Foy,Rachel McAdams,Marion Cotillard,56720,1339152.0,"['airplane', 'parent child relationship', 'philosophy', 'dystopia', 'utopia', 'little boy', 'old man', 'growing up', 'stop motion', 'neighbor', 'school', 'little girl', ""based on children's book"", 'social differences']",2025-07-18
741,742,Detachment,2011,NR,98,Drama,7.7,A substitute teacher who drifts from classroom to classroom finds a connection to the students and teachers during his latest assignment.,52.0,Tony Kaye,Adrien Brody,Christina Hendricks,Marcia Gay Harden,Lucy Liu,77071,71177.0,"['depression', 'falsely accused', 'professor', 'classroom', 'grandfather', 'unhappiness', 'animal abuse', 'dreary', 'escola']",2014-05-08
742,743,Midnight in Paris,2011,PG-13,96,"Comedy, Fantasy, Romance",7.7,"While on a trip to Paris with his fiancée's family, a nostalgic screenwriter finds himself mysteriously going back to the 1920s every day at midnight.",81.0,Woody Allen,Owen Wilson,Rachel McAdams,Kathy Bates,Kurt Fuller,388089,56816662.0,"['paris, france', 'based on novel or book', 'detective', 'screenwriter', 'camping', 'diary', 'time travel', 'forbidden love', 'painter', 'midnight', 'nostalgia', 'past', 'versailles', 'sculpture', 'romance', 'magic realism', 'nostalgic', 'art history', 'back in time', 'wine drinking']",2025-02-12
743,744,The Lego Movie,2014,PG,100,"Animation, Action, Adventure",7.7,"An ordinary LEGO construction worker, thought to be the prophesied as ""special"", is recruited to join a quest to stop an evil tyrant from gluing the LEGO universe into eternal stasis.",83.0,Christopher Miller,Phil Lord,Chris Pratt,Will Ferrell,Elizabeth Banks,323982,257760692.0,"['friendship', 'parent child relationship', 'prophecy', 'superhero', 'villain', 'based on comic', 'part live action', 'based on toy', 'falling in love', 'anti villain', 'super power', 'good cop bad cop', 'duringcreditsstinger', 'live action and animation', 'lego', 'father son relationship', 'loving', 'mischievous', 'playful', 'irreverent', 'evil tyrant', 'witty', 'hilarious', 'whimsical', 'celebratory', 'euphoric', 'exhilarated', 'exuberant', 'ridiculous']",2016-04-18
744,745,Gravity,2013,PG-13,91,"Drama, Sci-Fi, Thriller",7.7,Two astronauts work together to survive after an accident leaves them stranded in space.,96.0,Alfonso Cuarón,Sandra Bullock,George Clooney,Ed Harris,Orto Ignatiussen,769145,274092705.0,"['space mission', 'loss', 'space', 'astronaut', 'space station', 'trapped in space', 'inspirational', 'ambiguous', 'awestruck', 'foreboding', 'tragic']",2025-05-16
745,746,Star Trek Into Darkness,2013,PG-13,132,"Action, Adventure, Sci-Fi",7.7,"After the crew of the Enterprise find an unstoppable force of terror from within their own organization, Captain Kirk leads a manhunt to a war-zone world to capture a one-man weapon of mass destruction.",72.0,J.J. Abrams,Chris Pine,Zachary Quinto,Zoe Saldana,Benedict Cumberbatch,463188,228778661.0,"['spacecraft', 'friendship', 'sequel', 'alien', 'futuristic', 'space', 'mysterious force', 'space opera', 'terrorist bombing', 'new beginning']",2015-03-13
746,747,Beasts of No Nation,2015,R,137,"Drama, War",7.7,"A drama based on the experiences of Agu, a child soldier fighting in the civil war of an unnamed African country.",79.0,Cary Joji Fukunaga,Abraham Attah,Emmanuel Affadzi,Ricky Adelayitor,Andrew Adote,73964,83861.0,"['guerrilla warfare', 'civil war', 'based on novel or book', 'africa', 'refugee', 'machete', 'drug use', 'jungle', 'child soldier', 'west africa', 'children in wartime', 'brutal violence']",2019-06-04
747,748,The Social Network,2010,PG-13,120,"Biography, Drama",7.7,"As Harvard student Mark Zuckerberg creates the social networking site that would become known as Facebook, he is sued by the twins who claimed he stole their idea, and by the co-founder who was later squeezed out of the business.",95.0,David Fincher,Jesse Eisenberg,Andrew Garfield,Justin Timberlake,Rooney Mara,624982,96962694.0,"['hacker', 'based on novel or book', 'boston, massachusetts', 'ex-girlfriend', 'harvard university', 'narcissism', 'based on true story', 'hacking', 'historical fiction', 'twins', 'double cross', 'creator', 'frat party', 'social network', 'deposition', 'intellectual property', 'entrepreneur', 'arrogance', 'social media', 'meditative', 'young entrepreneur', 'facebook', 'legal drama', 'antagonistic', 'callous', 'wry']",2025-04-11
748,749,X: First Class,2011,PG-13,131,"Action, Adventure, Sci-Fi",7.7,"In the 1960s, superpowered humans Charles Xavier and Erik Lensherr work together to find others like them, but Erik's vengeful pursuit of an ambitious mutant who ruined his life causes a schism to divide them.",65.0,Matthew Vaughn,James McAvoy,Michael Fassbender,Jennifer Lawrence,Kevin Bacon,645512,146408305.0,"['central intelligence agency (cia)', 'nuclear war', 'superhero', 'mutant', 'mine', 'based on comic', 'superhuman', 'historical fiction', 'cuban missile crisis', 'world war iii', '1960s', 'amused', 'powerful']",2020-04-07
749,750,The Hangover,2009,R,100,Comedy,7.7,"Three buddies wake up from a bachelor party in Las Vegas, with no memory of the previous night and the bachelor missing. They make their way around the city in order to find their friend before his wedding.",73.0,Todd Phillips,Zach Galifianakis,Bradley Cooper,Justin Bartha,Ed Helms,717559,277322503.0,"['blackjack', 'stag night', 'lost weekend', 'chapel', 'hit with tire iron', 'memory loss', 'las vegas', 'drugs', 'irreverent', 'absurd', 'dramatic', 'hilarious', 'amused', 'celebratory', 'farcical', 'shaggy dog story']",2013-02-26
750,751,Skyfall,2012,PG-13,143,"Action, Adventure, Thriller",7.7,"James Bond's loyalty to M is tested when her past comes back to haunt her. When MI6 comes under attack, 007 must track down and destroy the threat, no matter how personal the cost.",81.0,Sam Mendes,Daniel Craig,Javier Bardem,Naomie Harris,Judi Dench,630614,304360277.0,"['spy', 'secret agent', 'sociopath', 'police impersonator', 'mi6', 'killer', 'art gallery', 'british secret service', 'uzi', 'booby trap', 'macao', 'komodo dragon', 'intense', 'vibrant']",2015-07-12
751,752,Silver Linings Playbook,2012,R,122,"Comedy, Drama, Romance",7.7,"After a stint in a mental institution, former teacher Pat Solitano moves back in with his parents and tries to reconcile with his ex-wife. Things get more challenging when Pat meets Tiffany, a mysterious girl with problems of her own.",81.0,David O. Russell,Bradley Cooper,Jennifer Lawrence,Robert De Niro,Jacki Weaver,661871,132092958.0,"['depression', 'infidelity', 'dancing', 'friendship', 'philadelphia, pennsylvania', 'based on novel or book', 'widow', 'superstition', 'letter', 'dance competition', 'teacher', 'mental institution', 'therapy', 'mental illness', 'ex-wife', 'institutionalization', 'death of husband', 'unfaithful wife', 'father son relationship']",2022-09-26
752,753,Argo,2012,R,120,"Biography, Drama, Thriller",7.7,"Acting under the cover of a Hollywood producer scouting a location for a science fiction film, a CIA agent launches a dangerous operation to rescue six Americans in Tehran during the U.S. hostage crisis in Iran in 1979.",86.0,Ben Affleck,Ben Affleck,Bryan Cranston,John Goodman,Alan Arkin,572581,136025503.0,"['central intelligence agency (cia)', 'husband wife relationship', 'revolution', 'press conference', 'biography', 'american abroad', 'extraction', 'iran hostage crisis', 'intelligence agent', 'langley virginia', '1980s', 'political thriller', 'factual']",2015-05-11
753,754,(500) Days of Summer,2009,PG-13,95,"Comedy, Drama, Romance",7.7,"An offbeat romantic comedy about a woman who doesn't believe true love exists, and the young man who falls for her.",76.0,Marc Webb,Zooey Deschanel,Joseph Gordon-Levitt,Geoffrey Arend,Chloë Grace Moretz,472242,32391374.0,"['jealousy', 'gallery', 'fight', 'date', 'architect', 'interview', 'sister', 'love', 'friends', 'fate', 'los angeles, california', 'summer', 'year', 'heartache', 'assertive']",2025-07-11
754,755,Harry Potter and the Deathly Hallows: Part 1,2010,PG-13,146,"Adventure, Family, Fantasy",7.7,"As Harry, Ron, and Hermione race against time and evil to destroy the Horcruxes, they uncover the existence of the three most powerful objects in the wizarding world: the Deathly Hallows.",65.0,David Yates,Daniel Radcliffe,Emma Watson,Rupert Grint,Bill Nighy,479120,295983305.0,"['witch', 'friendship', 'london, england', 'corruption', 'escape', 'teleportation', 'isolation', 'magic', 'bravery', 'radio', 'road trip', 'shelter', 'tension', 'attack', 'werewolf', 'ghost', 'road movie', 'wizard', 'christmas', 'based on young adult novel']",2024-11-22
755,756,Gake no ue no Ponyo,2008,G,101,"Animation, Adventure, Comedy",7.7,"A five-year-old boy develops a relationship with Ponyo, a young goldfish princess who longs to become a human after falling in love with him.",86.0,Hayao Miyazaki,Cate Blanchett,Matt Damon,Liam Neeson,Tomoko Yamaguchi,125317,15090400.0,"['princess', 'fish', 'cliff', 'mermaid', 'anime', 'lighthearted', 'sentimental', 'adventure', 'whimsical']",2024-12-05
756,757,Frost/Nixon,2008,R,122,"Biography, Drama, History",7.7,A dramatic retelling of the post-Watergate television interviews between British talk-show host David Frost and former president Richard Nixon.,80.0,Ron Howard,Frank Langella,Michael Sheen,Kevin Bacon,Sam Rockwell,103330,18593156.0,"['usa president', 'politics', '1970s', 'camera', 'lie', 'watergate scandal', 'scandal', 'richard nixon', 'reporter', 'writer']",2022-10-25
757,758,Papurika,2006,R,90,"Animation, Drama, Fantasy",7.7,"When a machine that allows therapists to enter their patients' dreams is stolen, all Hell breaks loose. Only a young female therapist, Paprika, can stop it.",81.0,Satoshi Kon,Megumi Hayashibara,Tôru Emori,Katsunosuke Hori,Tôru Furuya,71379,881302.0,"['research', 'japan', 'dreams', 'based on novel or book', 'procession', 'psychoanalysis', 'mad scientist', 'dream girl', 'parallel world', 'adult animation', 'dream world', 'anime', 'avant garde']",2025-02-08
758,759,Changeling,2008,R,141,"Biography, Crime, Drama",7.7,Grief-stricken mother Christine Collins (Angelina Jolie) takes on the L.A.P.D. to her own detriment when it tries to pass off an obvious impostor as her missing child.,63.0,Clint Eastwood,Angelina Jolie,Colm Feore,Amy Ryan,Gattlin Griffith,239203,35739802.0,"['biography', 'based on true story', 'clergyman', 'child in peril', 'police corruption', 'los angeles, california', 'single mother', 'street urchin', 'missing child', 'mental asylum', 'mental hospital', 'shock treatment', '1920s', 'missing son', 'mother son relationship', 'desperate woman', 'disbelieving cop', 'child abduction', 'telephone switchboard operator', 'female hysteria', 'police coverup', 'apathetic']",2021-09-12
759,760,Flipped,2010,PG,90,"Comedy, Drama, Romance",7.7,Two eighth-graders start to have feelings for each other despite being total opposites.,45.0,Rob Reiner,Madeline Carroll,Callan McAuliffe,Rebecca De Mornay,Anthony Edwards,81446,1752214.0,"['based on novel or book', 'shyness', 'family relationships', 'unrequited love', 'neighbor', 'teenage boy', 'first crush', 'young love', 'opposites attract', 'multiple perspectives', '1950s', '1960s', 'based on young adult novel']",2017-07-12
760,761,Toki o kakeru shôjo,2006,NR,98,"Animation, Adventure, Comedy",7.7,"A high-school girl named Makoto acquires the power to travel back in time, and decides to use it for her own personal benefits. Little does she know that she is affecting the lives of others just as much as she is her own.",,Mamoru Hosoda,Riisa Naka,Takuya Ishida,Mitsutaka Itakura,Ayami Kakiuchi,60368,,"['high school', 'time travel', 'surrealism', 'love', 'slice of life', 'teenage girl', 'school', 'schoolgirl', 'jumping from height', 'teenage romance', 'anime', 'japanese high school', 'time manipulation', 'familiar']",2025-09-28
761,762,Death Note: Desu nôto,2006,R,126,"Crime, Drama, Fantasy",7.7,"A battle between the world's two greatest minds begins when Light Yagami finds the Death Note, a notebook with the power to kill, and decides to rid the world of criminals.",,Shûsuke Kaneko,Tatsuya Fujiwara,Ken'ichi Matsuyama,Asaka Seto,Yû Kashii,28630,,"['suicide', 'police', 'heart attack', 'fbi', 'moral ambiguity', 'notebook', 'remake', 'murder', 'serial killer', 'tokyo, japan', 'based on manga', 'criminal', 'death', 'father son relationship', 'shinigami', 'japanese', 'supernatural power', 'psychotronic film', 'battle of wits', '死亡筆記']",2017-08-02
762,763,This Is England,2006,NR,101,"Crime, Drama",7.7,"A young boy becomes friends with a gang of skinheads. Friends soon become like family, and relationships will be pushed to the very limit.",86.0,Shane Meadows,Thomas Turgoose,Stephen Graham,Jo Hartley,Andrew Shim,115576,327919.0,"['skinhead', 'england', 'vandalism', 'drugs', 'falklands war', 'xenophobia', '1980s']",2008-09-12
763,764,Ex Machina,2014,R,108,"Drama, Sci-Fi, Thriller",7.7,A young programmer is selected to participate in a ground-breaking experiment in synthetic intelligence by evaluating the human qualities of a highly advanced humanoid A.I.,78.0,Alex Garland,Alicia Vikander,Domhnall Gleeson,Oscar Isaac,Sonoya Mizuno,474141,25442958.0,"['android', 'dancing', 'friendship', 'man vs machine', 'distrust', 'artificial intelligence (a.i.)', 'isolation', 'technology', 'manipulation', 'deception', 'norway', 'laboratory', 'robot', 'power outage', 'surveillance camera', 'consciousness', 'existentialism', 'lockdown', 'female cyborg', 'human android relationship', 'critical', 'intense']",2022-07-17
764,765,Efter brylluppet,2006,12,120,Drama,7.7,"A manager of an orphanage in India is sent to Copenhagen, Denmark, where he discovers a life-altering family secret.",78.0,Susanne Bier,Mads Mikkelsen,Sidse Babett Knudsen,Rolf Lassgård,Neeral Mulchandani,32001,412544.0,"['daughter', 'copenhagen, denmark', 'marriage crisis', 'orphanage', 'wealth', 'wedding', 'india', 'family', 'woman director', 'fear of dying']",2010-07-30
765,766,The Last King of Scotland,2006,R,123,"Biography, Drama, History",7.7,Based on the events of the brutal Ugandan dictator Idi Amin's regime as seen by his personal physician during the 1970s.,74.0,Kevin Macdonald,James McAvoy,Forest Whitaker,Gillian Anderson,Kerry Washington,175355,17605861.0,"['diplomat', 'luxury', 'naivety', 'based on novel or book', 'general', 'kidnapping', 'dictator', 'africa', 'mass murder', '1970s', 'affectation', 'charisma', 'polygamy', 'uganda', 'dictatorship', 'historical fiction', 'doctor', 'angry', 'zealous', 'idi amin', 'scottish', 'kampala', 'absurd', 'admiring', 'ambiguous', 'ambivalent', 'vibrant']",2021-02-23
766,767,Zodiac,2007,R,157,"Crime, Drama, Mystery",7.7,"In the late 1960s/early 1970s, a San Francisco cartoonist becomes an amateur detective obsessed with tracking down the Zodiac Killer, an unidentified individual who terrorizes Northern California with a killing spree.",78.0,David Fincher,Jake Gyllenhaal,Robert Downey Jr.,Mark Ruffalo,Anthony Edwards,466080,33080084.0,"['newspaper', 'journalist', 'california', 'based on novel or book', 'police', 'san francisco, california', 'killing', 'detective', '1970s', 'investigation', 'victim', 'code', 'murder', 'serial killer', 'crime scene', 'reporter', 'whodunit', 'alcoholic', 'young man', 'fourth of july', 'newspaper article', 'curious', 'cartoonist', '1960s', 'zodiac killer', 'clinical', 'bar', 'ambiguous', 'foreboding', 'ominous']",2024-08-12
767,768,Lucky Number Slevin,2006,R,110,"Action, Crime, Drama",7.7,"A case of mistaken identity lands Slevin into the middle of a war being plotted by two of the city's most rival crime bosses. Under constant surveillance by Detective Brikowski and assassin Goodkat, he must get them before they get him.",53.0,Paul McGuigan,Josh Hartnett,Ben Kingsley,Morgan Freeman,Lucy Liu,299524,22494487.0,"['sniper', 'assassin', 'assassination', 'gambling debt', 'identity', 'boss', 'gangster', 'mistake in person', 'fbi', 'murder', 'sniper rifle', 'horse racing', 'gambler', 'hoodlum', 'aggressive', 'amused', 'assertive']",2009-02-21
768,769,Joyeux Noël,2005,PG-13,116,"Drama, History, Music",7.7,"In December 1914, an unofficial Christmas truce on the Western Front allows soldiers from opposing sides of the First World War to gain insight into each other's way of life.",70.0,Christian Carion,Diane Kruger,Benno Fürmann,Guillaume Canet,Natalie Dessay,28003,1054361.0,"['world war i', 'based on true story', 'truce', 'opera singer', 'christmas', '1910s', 'trench warfare', ""no man's land"", 'christmas eve']",2007-02-05
769,770,Control,2007,R,122,"Biography, Drama, Music",7.7,"A profile of Ian Curtis, the enigmatic singer of Joy Division whose personal, professional, and romantic troubles led him to commit suicide at the age of 23.",78.0,Anton Corbijn,Sam Riley,Samantha Morton,Craig Parkinson,Alexandra Maria Lara,61609,871577.0,"['suicide', 'new love', 'wife', 'epilepsy', 'medicine', 'punk rock', 'recording contract', 'record producer', 'record label', 'black and white', 'extramarital affair', 'joy division', 'tragic']",2012-04-12
