,Unnamed: 0,Series_Title,Released_Year,Certificate,Runtime,Genre,IMDB_Rating,Overview,Meta_score,Director,Star1,Star2,Star3,Star4,No_of_Votes,Gross,Keywords,date_details
498,499,Fantastic Mr. Fox,2009,PG,87,"Animation, Adventure, Comedy",7.9,An urbane fox cannot resist returning to his farm raiding ways and then must help his community survive the farmers' retaliation.,83.0,Wes Anderson,George Clooney,Meryl Streep,Bill Murray,Jason Schwartzman,199696,21002919.0,"['based on novel or book', 'tree', 'peasant', 'fox', 'affectation', 'cider', 'tale', 'farm life', 'anthropomorphism', 'revenge', 'stop motion', 'curious', 'candid', 'philosophical', 'reflective', 'inspirational', 'dramatic', 'witty', 'intense', 'admiring', 'adoring', 'ambiguous', 'euphoric', 'optimistic']",2022-02-04
499,500,C.R.A.Z.Y.,2005,NR,129,"Comedy, Drama",7.9,"A young French-Canadian, growing up in the 1960s and 1970s, struggles to reconcile his emerging homosexuality with his father's conservative values and his own Catholic beliefs.",81.0,Jean-Marc Vallée,Michel Côté,Marc-André Grondin,Danielle Proulx,Émile Vallée,31476,,"['coming out', 'canada', 'sibling relationship', 'parent child relationship', 'insurgence', 'quebec', 'coming of age', 'lgbt', 'thoughtful', 'philosophical', 'loving', 'gay theme', 'gentle', 'hopeful']",2022-06-03
500,501,Les choristes,2004,PG,97,"Drama, Music",7.9,The new teacher at a severely administered boys' boarding school works to positively affect the students' lives through music.,56.0,Christophe Barratier,Gérard Jugnot,François Berléand,Jean-Baptiste Maunier,Kad Merad,57430,3635164.0,"['penalty', 'boarding school', 'choir', 'diary', 'musical', ""boys' choir"", 'dormitory', 'principal', ""boys' boarding school"", '1940s']",2013-03-20
501,502,Iron Man,2008,PG-13,126,"Action, Adventure, Sci-Fi",7.9,"After being held captive in an Afghan cave, billionaire engineer Tony Stark creates a unique weaponized suit of armor to fight evil.",79.0,Jon Favreau,Robert Downey Jr.,Gwyneth Paltrow,Terrence Howard,Jeff Bridges,939644,318412101.0,"['middle east', 'superhero', 'arms dealer', 'malibu', 'based on comic', 'aftercreditsstinger', 'marvel cinematic universe (mcu)', 'counterterrorism', 'irreverent', 'powerful']",2008-10-01
502,503,Shaun of the Dead,2004,R,99,"Comedy, Horror",7.9,A man's uneventful life is disrupted by the zombie apocalypse.,76.0,Edgar Wright,Simon Pegg,Nick Frost,Kate Ashfield,Lucy Davis,512249,13542874.0,"['london, england', 'dark comedy', 'satire', 'surrey', 'parody', 'slacker', 'friends', 'survival', 'zombie', 'cynical', 'survival horror', 'british pub', 'boyfriend girlfriend relationship', 'taunting', 'zombie apocalypse', 'frantic', 'satirical', 'desperate', 'anxious', 'playful', 'dramatic', 'suspenseful', 'witty', 'amused', 'defiant', 'exuberant', 'farcical']",2025-09-25
503,504,Gegen die Wand,2004,R18+,121,"Drama, Romance",7.9,"With the intention to break free from the strict familial restrictions, a suicidal young woman sets up a marriage of convenience with a forty-year-old addict, an act that will lead to an outburst of envious love.",78.0,Fatih Akin,Birol Ünel,Sibel Kekilli,Güven Kiraç,Zarah Jane McKenzie,51325,,"['drug abuse', 'religious education', 'alcohol', 'fictitious marriage', 'homicide', 'roommates', 'religion and supernatural', 'turkey', 'love', 'family', 'hamburg, germany']",2025-07-08
504,505,Mystic River,2003,R,138,"Crime, Drama, Mystery",7.9,The lives of three men who were childhood friends are shattered when one of them has a family tragedy.,84.0,Clint Eastwood,Sean Penn,Tim Robbins,Kevin Bacon,Emmy Rossum,419420,90135191.0,"['child abuse', 'sexual abuse', ""workers' quarter"", 'based on novel or book', 'loss of loved one', 'suppressed past', 'boston, massachusetts', 'repayment', 'arbitrary law', 'loyalty', 'massachusetts', 'whodunit', 'biting', 'guilt', 'childhood sexual abuse', 'mysterious', 'grim', 'vengeance', 'poker race', 'sex abuse', 'forceful', 'ominous']",2023-10-31
505,506,Harry Potter and the Prisoner of Azkaban,2004,PG,142,"Adventure, Family, Fantasy",7.9,"Harry Potter, Ron and Hermione return to Hogwarts School of Witchcraft and Wizardry for their third year of study, where they delve into the mystery surrounding an escaped prisoner who poses a dangerous threat to the young wizard.",82.0,Alfonso Cuarón,Daniel Radcliffe,Emma Watson,Rupert Grint,Richard Griffiths,552493,249358727.0,"['witch', 'school friend', 'friendship', 'flying', 'magic', 'bus', 'traitor', 'child hero', 'school of witchcraft', 'black magic', 'time travel', 'school', 'best friend', 'werewolf', 'muggle', 'ghost', 'wizard', 'aftercreditsstinger', 'magical creature', 'night bus', 'teenage life', 'christmas', 'school class', 'based on young adult novel', 'magic spell', 'enchant']",2025-02-15
506,507,Ying xiong,2002,PG-13,120,"Action, Adventure, History",7.9,"A defense officer, Nameless, was summoned by the King of Qin regarding his success of terminating three warriors.",85.0,Yimou Zhang,Jet Li,Tony Chiu-Wai Leung,Maggie Cheung,Ziyi Zhang,173999,53710019.0,"['martial arts', 'kung fu', 'right and justice', 'countryside', 'loss of loved one', 'patriot', 'wuxia', 'warring states period', '3rd century bc', 'grand', 'admiring']",2010-08-04
507,508,Hable con ella,2002,R,112,"Drama, Mystery, Romance",7.9,Two men share an odd friendship while they care for two women who are both in deep comas.,86.0,Pedro Almodóvar,Rosario Flores,Javier Cámara,Darío Grandinetti,Leonor Watling,104691,9284265.0,"['dying and death', 'journalist', 'friendship', 'suicide', 'rape', 'coma', 'bullfighting', 'spain', 'sexual abuse', 'madrid, spain', 'pregnancy', 'car crash', 'matador (bullfighter)', 'hospital']",2019-06-19
508,509,No Man's Land,2001,R,98,"Comedy, Drama, War",7.9,"Bosnia and Herzegovina during 1993 at the time of the heaviest fighting between the two warring sides. Two soldiers from opposing sides in the conflict, Nino and Ciki, become trapped in no man's land, whilst a third soldier becomes a living booby trap.",84.0,Danis Tanovic,Branko Djuric,Rene Bitorajac,Filip Sovagovic,Georges Siatidis,44618,1059830.0,"['bosnia and herzegovina', 'recruit', 'bosnian war (1992-95)', 'united nations', 'anti war', 'land mine', 'unexploded bomb', 'peacekeeper']",2012-07-16
509,510,Cowboy Bebop: Tengoku no tobira,2001,R,115,"Animation, Action, Crime",7.9,"A terrorist explosion releases a deadly virus on the masses, and it's up the bounty-hunting Bebop crew to catch the cold-blooded culprit.",61.0,Shin'ichirô Watanabe,Tensai Okamura,Hiroyuki Okiura,Yoshiyuki Takei,Beau Billingslea,42897,1000045.0,"['halloween', 'revenge', 'space western', 'lethal virus', 'adult animation', 'neo-western', 'anime', 'excited', 'vibrant']",2024-02-02
510,511,The Bourne Identity,2002,PG-13,119,"Action, Mystery, Thriller",7.9,"A man is picked up by a fishing boat, bullet-riddled and suffering from amnesia, before racing to elude assassins and attempting to regain his memory.",68.0,Doug Liman,Franka Potente,Matt Damon,Chris Cooper,Clive Owen,508771,121661683.0,"['sniper', 'assassin', 'amnesia', 'paris, france', 'based on novel or book', 'escape', 'barcelona, spain', 'spy', 'secret identity', 'passport', 'mission of murder', 'lovers', 'flashback', 'shootout', 'foot chase', 'cell phone', 'multiple identities', 'surveillance camera', 'hamburg, germany', 'fishing boat', 'langley virginia', 'safe deposit box', 'hand to hand combat', 'action hero', 'bourne', 'jason bourne', 'intense', 'powerful']",2024-08-21
511,512,Nueve reinas,2000,R,114,"Crime, Drama, Thriller",7.9,"Two con artists try to swindle a stamp collector by selling him a sheet of counterfeit rare stamps (the ""nine queens"").",80.0,Fabián Bielinsky,Ricardo Darín,Gastón Pauls,Graciela Tenenbaum,María Mercedes Villagra,49721,1221261.0,"['hotel', 'con man', 'stamp', 'partner', 'money', 'revenge', 'scam', 'double crossed', 'counterfeit', 'grifter', 'con game', 'swindle', 'forgery', 'brother sister relationship', 'inspirational', 'con artists', 'absurd', 'con men', 'cine argentino', 'whimsical', 'vibrant', 'twist ending', 'stamp collector']",2003-03-06
512,513,Children of Men,2006,R,109,"Adventure, Drama, Sci-Fi",7.9,"In 2027, in a chaotic world in which women have become somehow infertile, a former activist agrees to help transport a miraculously pregnant woman to a sanctuary at sea.",84.0,Alfonso Cuarón,Julianne Moore,Clive Owen,Chiwetel Ejiofor,Michael Caine,465113,35552383.0,"['future', 'government', 'police state', 'based on novel or book', 'hippie', 'england', 'faith', 'chaos', 'refugee camp', 'rebel', 'dystopia', 'miracle', 'childlessness', 'survival', 'birth', 'alcoholic', 'bombing', 'dying', 'terrorist group', 'fertility', 'soldiers', 'violence']",2019-10-10
513,514,Almost Famous,2000,R,122,"Adventure, Comedy, Drama",7.9,A high-school boy is given the chance to write a story for Rolling Stone Magazine about an up-and-coming rock band as he accompanies them on their concert tour.,90.0,Cameron Crowe,Billy Crudup,Patrick Fugit,Kate Hudson,Frances McDormand,252586,32534850.0,"['hotel room', 'concert', ""rock 'n' roll"", 'stewardess', 'drug addiction', 'san diego, california', 'overdose', 'groupie', 'music journalist', 'heavy metal', 'based on true story', 'swimming pool', 'coming of age', 'promiscuity', 'on the road', 'domineering mother', 'reconciliation', 'semi autobiographical', 'innocence lost', 'bus trip', 'aspiring writer', 'mischievous', 'cautionary', 'teenager', 'amused', 'celebratory', 'comforting', 'frustrated', 'cleveland, ohio']",2021-03-08
514,515,Mulholland Dr.,2001,R,147,"Drama, Mystery, Thriller",7.9,"After a car wreck on the winding Mulholland Drive renders a woman amnesiac, she and a perky Hollywood-hopeful search for clues and answers across Los Angeles in a twisting venture beyond dreams and reality.",85.0,David Lynch,Naomi Watts,Laura Harring,Justin Theroux,Jeanne Bates,322031,7220243.0,"['amnesia', 'loss of sense of reality', 'schizophrenia', 'nightmare', 'hitman', 'suppressed past', 'identity', 'key', 'detective', 'job interview', 'bisexuality', 'trauma', 'hallucination', 'surreal', 'surrealism', 'casting', 'hollywood', 'los angeles, california', 'car accident', 'audition', 'doppelgänger', 'neo-noir', 'tragic']",2025-05-29
515,516,Toy Story 2,1999,G,92,"Animation, Adventure, Comedy",7.9,"When Woody is stolen by a toy collector, Buzz and his friends set out on a rescue mission to save Woody before he becomes a museum toy property with his roundup gang Jessie, Prospector, and Bullseye.",88.0,John Lasseter,Ash Brannon,Lee Unkrich,Tom Hanks,Tim Allen,527512,245852179.0,"['friendship', 'airplane', 'museum', 'prosecution', 'identity crisis', 'villain', 'flea market', 'collector', 'sequel', 'buddy', 'rescue team', 'prospector', 'garage sale', 'duringcreditsstinger', 'toy comes to life', 'personification', 'inanimate objects come to life', 'comforting']",2024-07-20
516,517,Boogie Nights,1997,R,155,Drama,7.9,"Back when sex was safe, pleasure was a business and business was booming, an idealistic porn producer aspires to elevate his craft to an art when he discovers a hot young talent.",85.0,Paul Thomas Anderson,Mark Wahlberg,Julianne Moore,Burt Reynolds,Luis Guzmán,239473,26400640.0,"[""new year's eve"", 'adultery', 'pornography', 'robbery', 'husband wife relationship', 'drug abuse', '1970s', 'cocaine', 'porn actor', 'custody battle', 'rags to riches', 'coming of age', 'alter ego', 'los angeles, california', 'drugs', 'porn industry', 'disco', 'voyeurism', 'curious', '1980s', 'candid', 'big dick', 'mother son relationship', 'introspective', 'dramatic', 'admiring', 'audacious', 'euphoric']",2003-06-27
517,518,Mimi wo sumaseba,1995,G,111,"Animation, Drama, Family",7.9,"A love story between a girl who loves reading books, and a boy who has previously checked out all of the library books she chooses.",75.0,Yoshifumi Kondô,Yoko Honna,Issey Takahashi,Takashi Tachibana,Shigeru Muroi,51943,,"['dreams', 'library', 'italy', 'violin', 'writing', 'education', 'love', 'train', 'based on manga', 'cartoon cat', 'high school student', 'nostalgic', 'violin maker', 'grade', 'shoujo', 'anime', 'inspirational', 'japanese junior high schooler', 'whimsical']",2025-01-10
518,519,Once Were Warriors,1994,R,102,"Crime, Drama",7.9,A family descended from Maori warriors is bedeviled by a violent father and the societal problems of being treated as outcasts.,77.0,Lee Tamahori,Rena Owen,Temuera Morrison,Mamaengaroa Kerr-Bell,Julian Arahanga,31590,2201126.0,"['individual', 'suicide', 'rape', 'strong woman', 'tattoo', 'slum', 'funeral', 'alcohol', 'tradition', 'approved school ', 'loss of loved one', 'despair', 'indigenous', 'ghetto', 'violent husband', 'new zealand', 'maori', 'lack of prospects', 'maori tradition', 'teacher', 'youth gang', 'crush', 'domestic violence', 'rebellious youth', 'alcohol abuse', 'incest', 'unemployment', 'auckland']",2001-01-16
519,520,True Romance,1993,R,119,"Crime, Drama, Romance",7.9,"In Detroit, a lonely pop culture geek marries a call girl, steals cocaine from her pimp, and tries to sell it in Hollywood. Meanwhile, the owners of the cocaine, the Mob, track them down in an attempt to reclaim it.",59.0,Tony Scott,Christian Slater,Patricia Arquette,Dennis Hopper,Val Kilmer,206918,12281500.0,"['hotel', 'parent child relationship', 'movie business', 'detective', 'mexican standoff', 'pimp', 'cocaine', 'ex-cop', 'love', 'murder', 'on the run', 'mafia', 'comic book shop', 'los angeles, california', 'drugs', 'detroit, michigan', 'illegal prostitution', 'sicilian', 'gun violence', 'aspiring actor', 'neo-noir', 'intimate', 'love on the run', 'suspenseful', 'intense', 'comforting', 'euphoric']",2020-08-01
520,521,Trois couleurs: Bleu,1993,R,94,"Drama, Music, Mystery",7.9,A woman struggles to find a way to live her life after the death of her husband and child.,85.0,Krzysztof Kieslowski,Juliette Binoche,Zbigniew Zamachowski,Julie Delpy,Benoît Régent,89836,1324974.0,"['france', 'paris, france', 'composer', 'pain', 'to compose', 'loss of loved one', 'psychological drama', 'french']",2024-09-04
521,522,Jûbê ninpûchô,1993,R,94,"Animation, Action, Adventure",7.9,A vagabond swordsman is aided by a beautiful ninja girl and a crafty spy in confronting a demonic clan of killers - with a ghost from his past as their leader - who are bent on overthrowing the Tokugawa Shogunate.,,Yoshiaki Kawajiri,Kôichi Yamadera,Emi Shinohara,Takeshi Aono,Osamu Saka,34529,,"['rescue', 'japan', 'bondage', 'sexual abuse', 'ninja', 'tragedy', 'cruelty', 'demon', 'female ninja', 'scroll', 'kunoichi', 'anime', 'horror']",2024-09-11
522,523,Carlito's Way,1993,R,144,"Crime, Drama, Thriller",7.9,"A Puerto Rican former convict, just released from prison, pledges to stay away from drugs and violence despite the pressure around him and lead on to a better life outside of N.Y.C.",65.0,Brian De Palma,Al Pacino,Sean Penn,Penelope Ann Miller,John Leguizamo,201000,36948322.0,"['new york city', 'based on novel or book', 'gangster', 'go-go dancer', 'release from prison', '1970s', 'puerto rico', 'cocaine', 'nightclub', 'criminal past', 'love', 'lawyer', 'drugs', 'disco', 'neo-noir']",2022-03-31
523,524,Edward Scissorhands,1990,PG-13,105,"Drama, Fantasy, Romance",7.9,"An artificial man, who was incompletely constructed and has scissors for hands, leads a solitary life. Then one day, a suburban lady meets him and introduces him to her world.",74.0,Tim Burton,Johnny Depp,Winona Ryder,Dianne Wiest,Anthony Michael Hall,447368,56362352.0,"['underdog', 'small town', 'unsociability', 'inventor', 'hairdresser', 'isolation', 'scissors', 'burglar', 'love at first sight', 'fairy tale', 'sadness', 'symbolism', 'castle', 'alone', 'flashback', 'tragic love', 'snow', 'gothic', 'told in flashback', 'christmas horror', 'christmas', 'artificial', 'hair salon', 'signs & wonders', 'wonder', 'love story', 'goth', 'frankenstein', 'introspective', 'topiary', 'sentimental', 'awestruck', 'cliché', 'compassionate', 'earnest', 'gentle', 'suburban gothic']",2024-09-08
524,525,My Left Foot: The Story of Christy Brown,1989,R,103,"Biography, Drama",7.9,"Christy Brown, born with cerebral palsy, learns to paint and write with his only controllable limb - his left foot.",97.0,Jim Sheridan,Daniel Day-Lewis,Brenda Fricker,Alison Whelan,Kirsten Sheridan,68076,14743391.0,"['bodily disabled person', 'poet', 'biography', 'based on true story', 'foot', 'flashback', 'author', 'working class', 'disabled', 'cerebral palsy']",2013-05-07
525,526,Crimes and Misdemeanors,1989,PG-13,104,"Comedy, Drama",7.9,An ophthalmologist's mistress threatens to reveal their affair to his wife while a married documentary filmmaker is infatuated with another woman.,77.0,Woody Allen,Martin Landau,Woody Allen,Bill Bernstein,Claire Bloom,54670,18254702.0,"['adultery', 'new york city', 'assassin', 'professor', 'brother-in-law', 'murder', 'mistress', 'doctor', 'hired killer', 'documentary filmmaking']",2003-12-08
526,527,The Untouchables,1987,R,119,"Crime, Drama, Thriller",7.9,"During the era of Prohibition in the United States, Federal Agent Eliot Ness sets out to stop ruthless Chicago gangster Al Capone and, because of rampant corruption, assembles a small, hand-picked team to help him.",79.0,Brian De Palma,Kevin Costner,Sean Connery,Robert De Niro,Charles Martin Smith,281842,76270454.0,"['chicago, illinois', 'prohibition era', 'gangster', 'baseball bat', 'white suit', 'tough cop', 'treasury agent', 'untouchable', 'tax evasion', 'jury tampering', '1930s']",2022-10-31
527,528,Hannah and Her Sisters,1986,PG-13,107,"Comedy, Drama",7.9,"Between two Thanksgivings two years apart, Hannah's husband falls in love with her sister Lee, while her hypochondriac ex-husband rekindles his relationship with her sister Holly.",90.0,Woody Allen,Mia Farrow,Dianne Wiest,Michael Caine,Barbara Hershey,67176,40084041.0,"['new york city', 'opera', 'writing', 'artist', 'thanksgiving', 'hypochondriac', 'dysfunctional family', 'langham', 'television producer', 'architecture', 'singing', 'writer', 'relationship', 'love affair', 'art', 'extramarital affair', 'fear of dying', 'sisters']",2017-02-20
528,529,Brazil,1985,R,132,"Drama, Sci-Fi",7.9,A bureaucrat in a dystopic society becomes an enemy of the state as he pursues the woman of his dreams.,84.0,Terry Gilliam,Jonathan Pryce,Kim Greist,Robert De Niro,Katherine Helmond,187567,9929135.0,"['dreams', 'government', 'bureaucracy', 'police state', 'great britain', 'technology', 'dystopia', 'office', 'dark comedy', 'satire', 'surrealism', 'steampunk', 'terrorism', 'bombing', 'job promotion', 'repairman', 'disturbed', 'christmas', 'irreverent', 'absurd', 'incredulous', 'ambiguous', 'baffled', 'preposterous']",2022-06-10
529,530,This Is Spinal Tap,1984,R,82,"Comedy, Music",7.9,"Spinal Tap, one of England's loudest bands, is chronicled by film director Marty DiBergi on what proves to be a fateful tour.",92.0,Rob Reiner,Rob Reiner,Michael McKean,Christopher Guest,Kimberly Stringer,128812,188751.0,"['rock star', 'groupie', 'parody', 'mockumentary', 'rock band', 'found footage', 'aftercreditsstinger', 'duringcreditsstinger', 'amplifier', 'music industry', 'metal band', 'amused', 'cheerful']",2025-08-24
530,531,A Christmas Story,1983,PG,93,"Comedy, Family",7.9,"In the 1940s, a young boy named Ralphie attempts to convince his parents, his teacher and Santa that a Red Ryder BB gun really is the perfect Christmas gift.",77.0,Bob Clark,Peter Billingsley,Melinda Dillon,Darren McGavin,Scott Schwartz,132947,20605209.0,"['holiday', 'nostalgia', 'young boy', 'snow', 'chinese restaurant', 'tongue', 'christmas tree dealer', 'mall santa', 'christmas', '1940s', 'cleveland, ohio', 'parker family', 'xmas eve']",2016-02-21
531,532,The Blues Brothers,1980,R,133,"Action, Adventure, Comedy",7.9,"Jake Blues, just released from prison, puts together his old band to save the Catholic home where he and his brother Elwood were raised.",60.0,John Landis,John Belushi,Dan Aykroyd,Cab Calloway,John Candy,183182,57229890.0,"['prison', 'chicago, illinois', 'dancing', 'concert', 'country music', 'nazi', 'jazz', 'nun', 'music instrument', 'blues', 'shopping mall', 'road trip', 'church', 'buddy', 'parole', 'music', 'audacious', 'awestruck', 'euphoric', 'ridiculous']",2011-08-24
532,533,Manhattan,1979,R,96,"Comedy, Drama, Romance",7.9,The life of a divorced television writer dating a teenage girl is further complicated when he falls in love with his best friend's mistress.,83.0,Woody Allen,Woody Allen,Diane Keaton,Mariel Hemingway,Michael Murphy,131436,45700000.0,"['adultery', 'lolita', 'new york city', 'based on novel or book', 'based on true story', 'love', 'mistress', 'black and white', 'writer', 'relationship', 'divorce', 'true crime', 'manhattan, new york city', 'married']",2023-09-14
533,534,All That Jazz,1979,R,123,"Drama, Music, Musical",7.9,"Director/choreographer Bob Fosse tells his own life story as he details the sordid career of Joe Gideon, a womanizing, drug-using dancer.",72.0,Bob Fosse,Roy Scheider,Jessica Lange,Ann Reinking,Leland Palmer,28223,37823676.0,"['movie business', 'show business', 'tap dancing', 'film in film', 'divorce', 'broadway', 'rainstorm', 'surgery', 'editing', 'semi autobiographical', 'restroom', 'screening room', 'amphetamine', 'prescription drug abuse', 'angel of death']",2007-04-03
534,535,Dawn of the Dead,1978,NR,127,"Action, Adventure, Horror",7.9,"Following an ever-growing epidemic of zombies that have risen from the dead, two Philadelphia S.W.A.T. team members, a traffic reporter, and his television executive girlfriend seek refuge in a secluded shopping mall.",71.0,George A. Romero,David Emge,Ken Foree,Scott H. Reiniger,Gaylen Ross,111512,5100000.0,"['helicopter', 'army', 'chaos', 'bite', 'materialism', 'machete', 'gore', 'martial law', 'state of emergency', 'shopping mall', 'infection', 'biker', 'truck', 'consumerism', 'zombie', 'motorcycle gang', 'exploding head', 'mall', 'tv production', 'zombie apocalypse', 'pittsburgh, pennsylvania', 'anxious', 'frightened', 'zombies']",2029-03-10
535,536,All the President's Men,1976,PG,138,"Biography, Drama, History",7.9,"""The Washington Post"" reporters Bob Woodward and Carl Bernstein uncover the details of the Watergate scandal that leads to President Richard Nixon's resignation.",84.0,Alan J. Pakula,Dustin Hoffman,Robert Redford,Jack Warden,Martin Balsam,103031,70600000.0,"['newspaper', 'journalist', 'plan', 'washington dc, usa', 'shadowing', 'politics', 'burglar', 'fbi', 'wiretap', 'watergate scandal', 'based on true story', 'conspiracy', 'newspaper man', 'watergate', 'confidential source']",2021-05-10
536,537,La montaña sagrada,1973,R,114,"Adventure, Drama, Fantasy",7.9,"In a corrupt, greed-fueled world, a powerful alchemist leads a messianic character and seven materialistic figures to the Holy Mountain, where they hope to achieve enlightenment.",76.0,Alejandro Jodorowsky,Alejandro Jodorowsky,Horacio Salinas,Zamira Saunders,Juan Ferrara,37183,61001.0,"['mexico', 'paraplegic', 'christianity', 'religion and supernatural', 'symbolism', 'surreal', 'satire', 'surrealism', 'thief', 'enlightenment', 'avant-garde', 'crucifix', 'blasphemy', 'alchemy', 'psychedelic', 'alchemist']",2023-05-26
537,538,Amarcord,1973,R,123,"Comedy, Drama, Family",7.9,A series of comedic and nostalgic vignettes set in a 1930s Italian coastal town.,,Federico Fellini,Magali Noël,Bruno Zanin,Pupella Maggio,Armando Brancia,39897,,"['small town', 'fascism', 'surrealism', 'sheik', 'coming of age', 'rural area', 'bathtub', 'semi autobiographical', '1930s']",2016-06-25
538,539,Le charme discret de la bourgeoisie,1972,PG,102,Comedy,7.9,"A surreal, virtually plotless series of dreams centered around six middle-class people and their consistently interrupted attempts to have a meal together.",93.0,Luis Buñuel,Fernando Rey,Delphine Seyrig,Paul Frankeur,Bulle Ogier,38737,198809.0,"['diplomat', 'dreams', 'nightmare', 'upper class', 'date', 'drug trafficking', 'guest', 'bishop', 'restaurant', 'surreal', 'bourgeoisie', 'satire', 'surrealism', 'dinner', 'terrorism', 'drink', 'oneiric', 'dream within a dream', 'small talk', 'anarchic comedy', 'absurd', 'unexpected situation']",2022-06-24
539,540,"Aguirre, der Zorn Gottes",1972,NR,95,"Action, Adventure, Biography",7.9,"In the 16th century, the ruthless and insane Don Lope de Aguirre leads a Spanish expedition in search of El Dorado.",,Werner Herzog,Klaus Kinski,Ruy Guerra,Helena Rojo,Del Negro,52397,,"['gold', 'sentence', 'peru', 'insanity', 'gold rush', 'amazon rainforest', 'float', 'south america', '16th century', 'conquest', 'new german cinema', 'indigenous peoples', 'amazon river', 'conquistador', 'age of discovery']",2014-05-19
540,541,Harold and Maude,1971,PG,91,"Comedy, Drama, Romance",7.9,"Young, rich, and obsessed with death, Harold finds himself changed forever when he meets lively septuagenarian Maude at a funeral.",62.0,Hal Ashby,Ruth Gordon,Bud Cort,Vivian Pickles,Cyril Cusack,70826,,"['dying and death', 'depression', 'suicide', 'life and death', 'age difference', 'birthday', 'suicide attempt', 'dead wish', 'cemetery', 'life planning', 'banjo', 'cliff', 'arranged marriage', 'coming of age', 'wealth', 'older woman younger man relationship', 'elderly lady', 'age-gap relationship']",2017-10-11
541,542,Patton,1970,PG,172,"Biography, Drama, War",7.9,The World War II phase of the career of controversial American general George S. Patton.,91.0,Franklin J. Schaffner,George C. Scott,Karl Malden,Stephen Young,Michael Strong,93741,61700000.0,"['general', 'steel helmet', 'allies', 'world war ii', 'normandy, france', 'dead soldier', 'tank', 'biography', 'historical figure', 'd-day', 'destiny', 'thoughtful', 'dramatic', 'commanding']",2021-11-19
