,Unnamed: 0,Series_Title,Released_Year,Certificate,Runtime,Genre,IMDB_Rating,Overview,Meta_score,Director,Star1,Star2,Star3,Star4,No_of_Votes,Gross,Keywords,date_details
0,1,The Godfather,1972,R,175,"Crime, Drama",9.2,An organized crime dynasty's aging patriarch transfers control of his clandestine empire to his reluctant son.,100.0,Francis Ford Coppola,Marlon Brando,Al Pacino,James Caan,Diane Keaton,1620367,134966411.0,"['based on novel or book', 'loss of loved one', 'love at first sight', 'italy', 'gangster', 'symbolism', 'patriarch', 'europe', 'organized crime', 'mafia', 'religion', 'lawyer', 'revenge motive', 'crime family', 'sicilian mafia', 'religious hypocrisy', 'gun violence', 'rise to power', 'dead horse', 'gang violence', '1940s', '1950s', 'complex', 'mafia war', 'amused', 'compassionate', 'complicated', 'enchant', 'le parrain', 'ο νονός', 'крёстный отец']",2025-09-12
1,2,The Dark Knight,2008,PG-13,152,"Action, Crime, Drama",9.0,"When the menace known as the Joker wreaks havoc and chaos on the people of Gotham, Batman must accept one of the greatest psychological and physical tests of his ability to fight injustice.",84.0,Christopher Nolan,Christian Bale,Heath Ledger,Aaron Eckhart,Michael Caine,2303232,534858444.0,"['sadism', 'chaos', 'secret identity', 'crime fighter', 'superhero', 'anti hero', 'scarecrow', 'based on comic', 'vigilante', 'organized crime', 'tragic hero', 'anti villain', 'criminal mastermind', 'district attorney', 'super power', 'super villain', 'neo-noir', 'bold']",2023-10-18
2,3,The Godfather: Part II,1974,R,202,"Crime, Drama",9.0,"The early life and career of Vito Corleone in 1920s New York City is portrayed, while his son, Michael, expands and tightens his grip on the family crime syndicate.",90.0,Francis Ford Coppola,Al Pacino,Robert De Niro,Robert Duvall,Diane Keaton,1129952,57300000.0,"[""new year's eve"", 'new york city', 'based on novel or book', 'italian american', 'cuba', 'italy', 'gangster', 'praise', 'blackmail', 'symbolism', 'senator', 'revenge', 'murder', 'betrayal', 'organized crime', 'extortion', 'mafia', 'lawyer', 'suburb', 'sicilian mafia', 'corrupt politician', 'aggressive', '1950s', 'new year', 'vindictive', 'cautionary', 'violence', 'admiring', 'audacious']",2025-06-01
3,4,12 Angry Men,1957,NR,96,"Crime, Drama",9.0,A jury holdout attempts to prevent a miscarriage of justice by forcing his colleagues to reconsider the evidence.,96.0,Sidney Lumet,Henry Fonda,Lee J. Cobb,Martin Balsam,John Fiedler,689845,4360000.0,"['death penalty', 'anonymity', 'court case', 'court', 'judge', 'jurors', 'father murder', 'class', 'heat', 'innocence', 'puerto rico', 'based on play or musical', 'black and white', 'courtroom', 'courtroom drama', 'dialog driven', 'persidangan', 'sidang']",2025-08-21
4,5,The Lord of the Rings: The Return of the King,2003,PG-13,201,"Action, Adventure, Drama",8.9,Gandalf and Aragorn lead the World of Men against Sauron's army to draw his gaze from Frodo and Sam as they approach Mount Doom with the One Ring.,94.0,Peter Jackson,Elijah Wood,Viggo Mortensen,Ian McKellen,Orlando Bloom,1642758,377845905.0,"['army', 'based on novel or book', 'elves', 'dwarf', 'magic', 'kingdom', 'obsession', 'bravery', 'castle', 'volcano', 'giant spider', 'sequel', 'honor', 'king', 'brutality', 'madness', 'split personality', 'fantasy world', 'wizard', 'epic battle', 'journey', 'ring', 'quest', 'live action and animation', ""hero's journey"", 'high fantasy', 'wraith', 'sword and sorcery', 'power madness', 'great war', 'trekking', 'good versus evil', 'sword making', 'war', 'admiring', 'winged creatures', 'armies', 'spirits']",2025-03-13
5,6,Pulp Fiction,1994,R,154,"Crime, Drama",8.9,"The lives of two mob hitmen, a boxer, a gangster and his wife, and a pair of diner bandits intertwine in four tales of violence and redemption.",94.0,Quentin Tarantino,John Travolta,Uma Thurman,Samuel L. Jackson,Bruce Willis,1826188,107928762.0,"['drug dealer', 'boxer', 'massage', 'stolen money', 'briefcase', 'crime boss', 'redemption', 'heirloom', 'dance competition', 'los angeles, california', 'theft', 'nonlinear timeline', 'multiple storylines', 'neo-noir']",2025-04-25
6,7,Schindler's List,1993,R,195,"Biography, Drama, History",8.9,"In German-occupied Poland during World War II, industrialist Oskar Schindler gradually becomes concerned for his Jewish workforce after witnessing their persecution by the Nazis.",94.0,Steven Spielberg,Liam Neeson,Ralph Fiennes,Ben Kingsley,Caroline Goodall,1213505,96898818.0,"['factory', 'hero', 'nazi', 'concentration camp', 'ss (nazi schutzstaffel)', 'holocaust (shoah)', 'world war ii', 'ghetto', 'jew persecution', 'kraków, poland', 'defense industry', 'auschwitz-birkenau concentration camp', 'biography', 'based on true story', 'industrialist', 'historical fiction', 'black and white', 'train', 'poland', 'evil', 'weapons manufacturer', 'nazi train']",2021-04-01
7,8,Inception,2010,PG-13,148,"Action, Adventure, Sci-Fi",8.8,A thief who steals corporate secrets through the use of dream-sharing technology is given the inverse task of planting an idea into the mind of a C.E.O.,74.0,Christopher Nolan,Leonardo DiCaprio,Joseph Gordon-Levitt,Elliot Page,Ken Watanabe,2067042,292576195.0,"['rescue', 'mission', 'dreams', 'airplane', 'paris, france', 'virtual reality', 'kidnapping', 'philosophy', 'spy', 'allegory', 'manipulation', 'car crash', 'heist', 'memory', 'architecture', 'los angeles, california', 'dream world', 'subconscious']",2025-03-14
8,9,Fight Club,1999,R,139,Drama,8.8,"An insomniac office worker and a devil-may-care soapmaker form an underground fight club that evolves into something much, much more.",66.0,David Fincher,Brad Pitt,Edward Norton,Meat Loaf,Zach Grenier,1854740,37030102.0,"['dual identity', 'rage and hate', 'based on novel or book', 'nihilism', 'fight', 'support group', 'dystopia', 'insomnia', 'alter ego', 'breaking the fourth wall', 'split personality', 'quitting a job', 'dissociative identity disorder', 'self destructiveness']",2024-03-15
9,10,The Lord of the Rings: The Fellowship of the Ring,2001,PG-13,178,"Action, Adventure, Drama",8.8,A meek Hobbit from the Shire and eight companions set out on a journey to destroy the powerful One Ring and save Middle-earth from the Dark Lord Sauron.,92.0,Peter Jackson,Elijah Wood,Ian McKellen,Orlando Bloom,Sean Bean,1661481,315544750.0,"['based on novel or book', 'elves', 'dwarf', 'magic', 'obsession', 'bravery', 'fireworks', 'mine', 'maze', 'mountain', 'castle', 'birthday party', 'troll', 'battle', 'demon', 'blizzard', 'uncle nephew relationship', 'fantasy world', 'journey', 'ring', 'invisibility', 'live action and animation', ""hero's journey"", 'wraith', 'sword and sorcery', 'trekking', 'good versus evil', 'inspirational']",2025-03-13
10,11,Forrest Gump,1994,PG-13,142,"Drama, Romance",8.8,"The presidencies of Kennedy and Johnson, the events of Vietnam, Watergate and other historical events unfold through the perspective of an Alabama man with an IQ of 75, whose only desire is to be reunited with his childhood sweetheart.",82.0,Robert Zemeckis,Tom Hanks,Robin Wright,Gary Sinise,Sally Field,1809221,330252182.0,"[""new year's eve"", 'vietnam war', 'vietnam veteran', 'mentally disabled', 'friendship', 'usa president', 'washington dc, usa', 'post-traumatic stress disorder (ptsd)', 'waitress', 'based on novel or book', 'hippie', 'single parent', 'parent child relationship', 'optimism', '1970s', 'drug addiction', 'autism', 'alabama', 'black panther party', 'bus stop', 'family relationships', 'chameleon', 'single mother', 'cynical', 'blunt', 'military', 'anti war protest', '1960s', 'college american football', 'mother son relationship', 'america', 'arrogant', 'cliché', 'disapproving', 'melodramatic', 'feel-good']",2024-07-19
11,12,"Il buono, il brutto, il cattivo",1966,R,161,Western,8.8,A bounty hunting scam joins two men in an uneasy alliance against a third in a race to find a fortune in gold buried in a remote cemetery.,90.0,Sergio Leone,Clint Eastwood,Eli Wallach,Lee Van Cleef,Aldo Giuffrè,688390,6100000.0,"['gold', 'army', 'bounty hunter', 'hitman', 'refugee', 'anti hero', 'moral ambiguity', 'gallows', 'outlaw', 'gun battle', 'shootout', 'spaghetti western', 'graveyard', 'american civil war', 'stolen gold', 'complex', 'hidden gold', 'gun death', 'cemetary', 'confederate gold']",2018-04-25
12,13,The Lord of the Rings: The Two Towers,2002,PG-13,179,"Action, Adventure, Drama",8.7,"While Frodo and Sam edge closer to Mordor with the help of the shifty Gollum, the divided fellowship makes a stand against Sauron's new ally, Saruman, and his hordes of Isengard.",87.0,Peter Jackson,Elijah Wood,Ian McKellen,Viggo Mortensen,Orlando Bloom,1485555,342551365.0,"['mission', 'army', 'based on novel or book', 'elves', 'dwarf', 'magic', 'obsession', 'bravery', 'castle', 'reincarnation', 'sequel', 'battle', 'brutality', 'guide', 'split personality', 'marsh', 'fantasy world', 'wizard', 'journey', 'ring', 'live action and animation', ""hero's journey"", 'high fantasy', 'wraith', 'sword and sorcery', 'trekking', 'evil spell', 'good versus evil', 'trees', 'admiring', 'amused', 'winged creatures']",2025-03-13
13,14,The Matrix,1999,R,136,"Action, Sci-Fi",8.7,"When a beautiful stranger leads computer hacker Neo to a forbidding underworld, he discovers the shocking truth--the life he knows is the elaborate deception of an evil cyber-intelligence.",73.0,Lana Wachowski,Lilly Wachowski,Keanu Reeves,Laurence Fishburne,Carrie-Anne Moss,1676426,171479930.0,"['man vs machine', 'martial arts', 'dreams', 'artificial intelligence (a.i.)', 'saving the world', 'hacker', 'self sacrifice', 'virtual reality', 'fight', 'prophecy', 'truth', 'philosophy', 'dystopia', 'insurgence', 'simulated reality ', 'cyberpunk', 'dream world', 'messiah', 'action hero', 'gnosticism', 'allegory of the cave']",2024-12-11
14,15,Goodfellas,1990,R,146,"Biography, Crime, Drama",8.7,"The story of Henry Hill and his life in the mob, covering his relationship with his wife Karen Hill and his mob partners Jimmy Conway and Tommy DeVito in the Italian-American crime syndicate.",90.0,Martin Scorsese,Robert De Niro,Ray Liotta,Joe Pesci,Lorraine Bracco,1020727,46836394.0,"['prison', 'florida', 'new york city', 'based on novel or book', 'gangster', 'mass murder', 'drug trafficking', '1970s', 'irish-american', 'gore', 'biography', 'based on true story', 'murder', 'organized crime', 'mafia', 'brooklyn, new york city', 'crime epic', 'tampa, florida']",2020-09-11
15,16,Star Wars: Episode V - The Empire Strikes Back,1980,PG,124,"Action, Adventure, Fantasy",8.7,"After the Rebels are brutally overpowered by the Empire on the ice planet Hoth, Luke Skywalker begins Jedi training with Yoda, while his friends are pursued by Darth Vader and a bounty hunter named Boba Fett all over the galaxy.",82.0,Irvin Kershner,Mark Hamill,Harrison Ford,Carrie Fisher,Billy Dee Williams,1159315,290475067.0,"['rebellion', 'android', 'spacecraft', 'asteroid', 'rebel', 'space battle', 'snowstorm', 'space colony', 'swamp', 'space opera', 'nostalgic', 'artic', 'excited']",2020-09-25
16,17,One Flew Over the Cuckoo's Nest,1975,R,133,Drama,8.7,"A criminal pleads insanity and is admitted to a mental institution, where he rebels against the oppressive nurse and rallies up the scared patients.",83.0,Milos Forman,Jack Nicholson,Louise Fletcher,Michael Berryman,Peter Brocco,918088,112000000.0,"['mentally disabled', 'friendship', 'based on novel or book', 'nurse', 'lunatic asylum', 'insane asylum', 'oregon, usa', 'hospital', 'medication', 'female villain', 'shock treatment', 'depressing', 'informative']",2025-09-11
17,18,Hamilton,2020,PG-13,160,"Biography, Drama, History",8.6,"The real life of one of America's foremost founding fathers and first Secretary of the Treasury, Alexander Hamilton. Captured live on Broadway from the Richard Rodgers Theater with the original Broadway cast.",90.0,Thomas Kail,Lin-Manuel Miranda,Phillipa Soo,Leslie Odom Jr.,Renée Elise Goldsberry,55291,,"['adultery', 'corruption', 'upper class', 'presidential election', 'musical', 'biography', 'stage show', 'based on play or musical', '18th century', 'broadway musical', 'pistol duel', 'american revolution', 'revolutionary war', 'founding fathers', 'stage musical', 'filmed play', 'live theatre', 'filmed theater', 'musical proshot']",2025-11-13
18,19,Gisaengchung,2019,R,132,"Comedy, Drama, Thriller",8.6,Greed and class discrimination threaten the newly formed symbiotic relationship between the wealthy Park family and the destitute Kim clan.,96.0,Bong Joon Ho,Kang-ho Song,Lee Sun-kyun,Cho Yeo-jeong,Choi Woo-sik,552778,53367844.0,"['dark comedy', 'private lessons', 'birthday party', 'con artist', 'working class', 'infiltration', 'psychological thriller', 'class differences', 'housekeeper', 'tutor', 'family', 'hidden room', 'unemployed', 'hiding in attic', 'domestic worker', 'wealthy family', 'south korea', 'caste violence', 'seoul, south korea']",2025-02-07
19,20,Soorarai Pottru,2020,U,153,Drama,8.6,"Nedumaaran Rajangam ""Maara"" sets out to make the common man fly and in the process takes on the world's most capital intensive industry and several enemies who stand in his way.",,Sudha Kongara,Suriya,Madhavan,Paresh Rawal,Aparna Balamurali,54995,,['biographical fiction'],2020-11-12
20,21,Interstellar,2014,PG-13,169,"Adventure, Drama, Sci-Fi",8.6,A team of explorers travel through a wormhole in space in an attempt to ensure humanity's survival.,74.0,Christopher Nolan,Matthew McConaughey,Anne Hathaway,Jessica Chastain,Mackenzie Foy,1512360,188020017.0,"['rescue', 'future', 'spacecraft', 'race against time', 'artificial intelligence (a.i.)', 'nasa', 'time warp', 'dystopia', 'expedition', 'space travel', 'wormhole', 'famine', 'hibernation', 'black hole', 'quantum mechanics', 'family relationships', 'space', 'robot', 'astronaut', 'scientist', 'single father', 'farmer', 'space station', 'space adventure', 'time paradox', 'cryonics', 'father daughter relationship', '2060s', 'cornfield', 'time manipulation']",2025-08-28
21,22,Cidade de Deus,2002,R,130,"Crime, Drama",8.6,"In the slums of Rio, two kids' paths diverge as one struggles to become a photographer and the other a kingpin.",79.0,Fernando Meirelles,Kátia Lund,Alexandre Rodrigues,Leandro Firmino,Matheus Nachtergaele,699256,7563397.0,"['street gang', 'photographer', 'gangster', 'rio de janeiro', 'gang war', 'ghetto', 'based on true story', 'coming of age', 'introspective', 'critical', 'tense', 'conceited']",2024-05-16
22,23,Sen to Chihiro no kamikakushi,2001,PG,125,"Animation, Adventure, Family",8.6,"During her family's move to the suburbs, a sullen 10-year-old girl wanders into a world ruled by gods, witches, and spirits, and where humans are changed into beasts.",96.0,Hayao Miyazaki,Daveigh Chase,Suzanne Pleshette,Miyu Irino,Rumi Hiiragi,651376,10055859.0,"['witch', 'parent child relationship', 'darkness', 'bath house', 'magic', 'spirit', 'parallel world', 'amusement park', 'youkai', 'japanese mythology', 'anime']",2025-01-03
23,24,Saving Private Ryan,1998,R,169,"Drama, War",8.6,"Following the Normandy Landings, a group of U.S. soldiers go behind enemy lines to retrieve a paratrooper whose brothers have been killed in action.",91.0,Steven Spielberg,Tom Hanks,Matt Damon,Tom Sizemore,Edward Burns,1235804,216540909.0,"['dying and death', 'epic', 'self sacrifice', 'bravery', 'world war ii', 'duty', 'normandy, france', 'troops', 'waffen ss', 'omaha beach', 'rescue mission', 'cowardice', 'us army', 'based on true story', 'd-day', 'military', 'german soldier', 'military operation', '1940s', 'bloody deaths', 'u.s. army soldier', 'u.s. army ranger', 'massive casualties']",2023-07-01
24,25,The Green Mile,1999,R,189,"Crime, Drama, Fantasy",8.6,"The lives of guards on Death Row are affected by one of their charges: a black man accused of child murder and rape, yet who has a mysterious gift.",61.0,Frank Darabont,Tom Hanks,Michael Clarke Duncan,David Morse,Bonnie Hunt,1147794,136801374.0,"['mentally disabled', 'based on novel or book', 'southern usa', 'psychopath', 'death row', 'jail guard', 'supernatural', 'great depression', 'prison guard', 'jail', 'electric chair', 'torture', 'magic realism', 'healing', 'grim', '1930s', 'abuse of power', 'depressed', 'ambiguous', 'authoritarian', 'cruel', 'hopeful']",2024-08-16
25,26,La vita è bella,1997,PG-13,116,"Comedy, Drama, Romance",8.6,"When an open-minded Jewish librarian and his son become victims of the Holocaust, he uses a perfect mixture of will, humor, and imagination to protect his son from the dangers around their camp.",59.0,Roberto Benigni,Roberto Benigni,Nicoletta Braschi,Giorgio Cantarini,Giustino Durano,623629,57598247.0,"['dying and death', 'bookshop', ""love of one's life"", 'nazi', 'self sacrifice', 'loss of loved one', 'italy', 'riddle', 'mass murder', 'concentration camp', 'fascism', 'holocaust (shoah)', 'world war ii', 'deportation', 'jew persecution', 'story teller', 'riding a bicycle', 'national socialism', 'dark comedy', 'charade', 'concentration camp prisoner', 'romcom', 'dark', 'war', 'nazi germany', 'admiring']",2020-08-01
26,27,Se7en,1995,R,127,"Crime, Drama, Mystery",8.6,"Two detectives, a rookie and a veteran, hunt a serial killer who uses the seven deadly sins as his motives.",65.0,David Fincher,Morgan Freeman,Brad Pitt,Kevin Spacey,Andrew Kevin Walker,1445096,100125643.0,"['rage and hate', 'police', 's.w.a.t.', 'sadism', 'self-fulfilling prophecy', 'psychopath', 'detective', 'investigation', 'insomnia', 'murder', 'serial killer', 'religion', 'shootout', 'corpse', 'macabre', 'seven deadly sins', 'depravity', 'neo-noir', 'calm', 'urban gothic', 'ambiguous', 'ominous', 'seven: los siete pecados capitales']",2025-02-28
27,28,The Silence of the Lambs,1991,R,118,"Crime, Drama, Thriller",8.6,"A young F.B.I. cadet must receive the help of an incarcerated and manipulative cannibal killer to help catch another serial killer, a madman who skins his victims.",85.0,Jonathan Demme,Jodie Foster,Anthony Hopkins,Lawrence A. Bonney,Kasi Lemmons,1270197,130742922.0,"['based on novel or book', 'kidnapping', 'psychopath', 'fbi', 'scientific study', 'murder', 'serial killer', 'psychological thriller', 'brutality', 'cannibal', 'psychiatrist', 'moth', 'virginia', 'neo-noir', 'twisted', 'skinning', 'past history', 'suspenseful', 'foreboding', 'ominous', 'psychological profiling']",2025-11-04
28,29,Star Wars,1977,PG,121,"Action, Adventure, Fantasy",8.6,"Luke Skywalker joins forces with a Jedi Knight, a cocky pilot, a Wookiee and two droids to save the galaxy from the Empire's world-destroying battle station, while also attempting to rescue Princess Leia from the mysterious Darth Vader.",90.0,George Lucas,Mark Hamill,Harrison Ford,Carrie Fisher,Alec Guinness,1231473,322740140.0,"['empire', 'galaxy', 'rebellion', 'android', 'hermit', 'smuggling (contraband)', 'freedom', 'rebel', 'rescue mission', 'space', 'planet', 'desert', 'super power', 'oppression', 'space opera', 'wizard', 'totalitarianism', 'awestruck', 'excited']",2027-04-30
29,30,Seppuku,1962,NR,133,"Action, Drama, Mystery",8.6,"When a ronin requesting seppuku at a feudal lord's palace is told of the brutal suicide of another ronin who previously visited, he reveals how their pasts are intertwined - and in doing so challenges the clan's integrity.",85.0,Masaki Kobayashi,Tatsuya Nakadai,Akira Ishihama,Shima Iwashita,Tetsurô Tanba,42004,,"['suicide', 'japan', 'samurai', 'asia', 'flashback', 'revenge', 'poverty', 'black and white', 'seppuku', 'ronin', 'jidaigeki', 'edo period', '17th century', 'shogunate', 'bushi', 'bakumatsu', 'distressing', 'excited']",2008-09-15
30,31,Shichinin no samurai,1954,NR,207,"Action, Adventure, Drama",8.6,A poor village under attack by bandits recruits seven unemployed samurai to help them defend themselves.,98.0,Akira Kurosawa,Toshirô Mifune,Takashi Shimura,Keiko Tsushima,Yukiko Shimazaki,315744,269061.0,"['epic', 'martial arts', 'japan', 'samurai', 'sword', 'peasant', 'village', 'looting', 'rice', 'fencing', 'moral ambiguity', 'black and white', 'battle', 'bandit', 'practice', 'jidaigeki', 'domineering', '16th century', 'plunder', 'bushi', 'awestruck']",2025-06-26
31,32,It's a Wonderful Life,1946,PG,130,"Drama, Family, Fantasy",8.6,An angel is sent from Heaven to help a desperately frustrated businessman by showing him what life would have been like if he had never existed.,89.0,Frank Capra,James Stewart,Donna Reed,Lionel Barrymore,Thomas Mitchell,405801,,"['small town', 'angel', 'suicide attempt', 'holiday', 'bank', 'melancholy', 'great depression', 'family business ', 'black and white', 'nervous breakdown', 'old house', 'newlywed', 'magic realism', 'told in flashback', 'alternative reality', 'guardian angel', 'high school dance', 'christmas', 'earnest', 'hopeful', 'sincere', 'xmas eve']",2024-12-12
32,33,Joker,2019,R,122,"Crime, Drama, Thriller",8.5,"In Gotham City, mentally troubled comedian Arthur Fleck is disregarded and mistreated by society. He then embarks on a downward spiral of revolution and bloody crime. This path brings him face-to-face with his alter-ego: the Joker.",59.0,Todd Phillips,Joaquin Phoenix,Robert De Niro,Zazie Beetz,Frances Conroy,939252,335451311.0,"['dreams', 'street gang', 'society', 'psychopath', 'clown', 'villain', 'based on comic', 'murder', 'psychological thriller', 'criminal mastermind', 'cynical', 'mental illness', 'anarchy', 'character study', 'clown makeup', 'prophetic', 'subway train', 'social realism', 'supervillain', 'tv host', '1980s', 'mother son relationship', 'origin story', 'falling into madness']",2024-09-27
33,34,Whiplash,2014,R,106,"Drama, Music",8.5,A promising young drummer enrolls at a cut-throat music conservatory where his dreams of greatness are mentored by an instructor who will stop at nothing to realize a student's potential.,88.0,Damien Chazelle,Miles Teller,J.K. Simmons,Melissa Benoist,Paul Reiser,717585,13092000.0,"['new york city', 'concert', 'jazz', 'musician', 'obsession', 'music teacher', 'conservatory', 'drums', 'montage', 'blunt', 'perfectionist', 'perfection', 'public humiliation', 'jazz band', 'young adult', 'music school', 'based on short', 'intense', 'drummer']",2024-12-06
34,35,The Intouchables,2011,R,112,"Biography, Comedy, Drama",8.5,"After he becomes a quadriplegic from a paragliding accident, an aristocrat hires a young man from the projects to be his caregiver.",57.0,Olivier Nakache,Éric Toledano,François Cluzet,Omar Sy,Anne Le Ny,760360,13182281.0,"['friendship', 'male friendship', 'based on true story', 'masseuse', 'aristocrat', 'paragliding', 'interracial friendship', 'unlikely friendship', 'duringcreditsstinger', 'quadriplegic', 'quadriplegia', 'feel good', 'intouchables']",2013-03-27
35,36,The Prestige,2006,PG-13,130,"Drama, Mystery, Sci-Fi",8.5,"After a tragic accident, two stage magicians engage in a battle to create the ultimate illusion while sacrificing everything they have to outwit each other.",66.0,Christopher Nolan,Christian Bale,Hugh Jackman,Scarlett Johansson,Michael Caine,1190259,53089891.0,"['dying and death', 'suicide', 'class society', 'london, england', 'magic', 'competition', 'obsession', 'hostility', 'class', 'diary', 'twist', 'tricks', 'illusion', 'rivalry', 'partner', 'steampunk', 'cruelty', 'hanging', 'jail cell', '19th century', 'nikola tesla', 'magician', 'tesla coil', 'bittersweet', 'secret', 'absurd', 'mind-blowing']",2021-12-15
36,37,The Departed,2006,R,151,"Crime, Drama, Thriller",8.5,An undercover cop and a mole in the police attempt to identify each other while infiltrating an Irish gang in South Boston.,85.0,Martin Scorsese,Leonardo DiCaprio,Matt Damon,Jack Nicholson,Mark Wahlberg,1189773,132384315.0,"['police', 'undercover', 'boston, massachusetts', 'gangster', 'irish-american', 'crime boss', 'friends', 'remake', 'mobster', 'organized crime', 'mafia', 'undercover cop', 'mole', 'state police', 'police training', 'realtor', 'dreary', 'frightened']",2011-01-12
37,38,The Pianist,2002,R,150,"Biography, Drama, Music",8.5,A Polish Jewish musician struggles to survive the destruction of the Warsaw ghetto of World War II.,85.0,Roman Polanski,Adrien Brody,Thomas Kretschmann,Frank Finlay,Emilia Fox,729603,32572577.0,"['concert', 'nazi', 'resistance', 'warsaw ghetto', 'polish resistance', 'homeland', 'holocaust (shoah)', 'hunger', 'world war ii', 'prisoner of war', 'ghetto', 'deportation', 'jew persecution', 'liberation', 'biography', 'survival', 'based on memoir or autobiography', 'pianist', 'poland', 'angry', 'complex', 'compassionate']",2024-04-18
38,39,Gladiator,2000,R,155,"Action, Adventure, Drama",8.5,A former Roman General sets out to exact vengeance against the corrupt emperor who murdered his family and sent him into slavery.,67.0,Ridley Scott,Russell Crowe,Joaquin Phoenix,Connie Nielsen,Oliver Reed,1341460,187705427.0,"['epic', 'gladiator', 'rome, italy', 'arena', 'senate', 'roman empire', 'parent child relationship', 'emperor', 'slavery', 'ancient rome', 'revenge', 'battlefield', 'slave auction', 'historical fiction', 'ancient world', 'combat', 'chariot', 'philosopher', 'barbarian horde', '2nd century', 'successor', 'commodus', 'maximus', 'serene', 'defiant', 'gladiador']",2024-09-27
39,40,American History X,1998,R,119,Drama,8.5,A former neo-nazi skinhead tries to prevent his younger brother from going down the same wrong path that he did.,62.0,Tony Kaye,Edward Norton,Edward Furlong,Beverly D'Angelo,Jennifer Lien,1034705,6719864.0,"['prison', 'neo-nazism', 'rape', 'skinhead', 'sibling relationship', 'swastika', 'nazi', 'brother', 'fascism', 'tragedy', 'jail', 'school', 'los angeles, california', 'family', 'xenophobia', 'interracial friendship', 'nazism', 'disturbed', 'violence', 'crime', 'distressing']",2012-11-02
